[
  {
    "question": "What are Maslow’s five need levels?",
    "answer": "Physiological, Safety, Belonging, Esteem, and Self-Actualization.",
    "contexts": [
      "7\nNeed-based theories\n8\nMASLOW AND THE HIERARCHY OF NEEDS\nHuman motivation is the response to the tension that weperceive in order to satisfy specificneedsThus, human behavior can be explained (and predicted)by analyzing our underlying needs\nNeed-Satisfaction Theory\n9\nMASLOW - THE HIERARCHY OF NEEDS\nPHYSIOLOGICAL NEEDS  (air, water, food, sleep, etc).These are primaries needs\nSAFETY NEEDS , they imply safety, security, order, predictability (home, family, work, money)",
      "BELONGING NEEDS, they imply the need to be accepted, to belong to a social group or context\nSELF- ESTEEM NEEDS, the need to feel competent or capableof doing something, and the need for others’ recognition\nSELF- ACTUALIZATION NEEDS, the need to satisfy own’sidentity and achieve goals that are consistent with desires and expectations\nIF SATISFIEDIF SATISFIEDIF SATISFIEDIF SATISFIED\n10\nTHE LOGIC OF THE HIERARCHY\nNeeds generate motivation in an orderly fashion",
      "Needs generate motivation in an orderly fashion\nSatisfied needs do not motivate until they re-emerge\nOnce a certain need is satisfied, motivation stems from unsatisfiedneeds (at a higher level)\nA higher level need is not motivating until a lower level need issatisfied"
    ],
    "type": "easy"
  },
  {
    "question": "What does ERG stand for in Alderfer’s theory?",
    "answer": "Existence, Relatedness, Growth.",
    "contexts": [
      "14\nALDERFER’S ERG MODEL\nSELF- ACTUALIZATION NEEDS\nSELF- ESTEEM NEEDS\nBELONGING NEEDS\nSAFETY NEEDS\nPHYSIOLOGICAL NEEDSGROWTHRELATEDNESSEXISTENCE\ndifferent needs may manifests themselves at the same time3 main kinds of needs: Existence, Relatedness, GrowthMASLOW ALDERFER\n15\nALDERFER’S ERG MODEL\nPrimary needs (phisiological, securety etc.)\nExistence Needs\nThe need to have social relations\nRelatedness Needs\nThe need to be appreciated, to be competent and to self-realization\nGrowth needs",
      "SATISFACTION / PROGRESSION: just like Maslow stated, a satisfied needignites a increased sensitivty to a higher level needFRUSTRATION / REGRESSION: if a higher level need cannot be satisfied,individual will try to maximize the satisfaction of a lower level need\nNOT JUST A VERTICAL PROGRESSION BETWEEN NEEDS\nprof. Giovanni Masino – Università di FerraraExistence needRelatedness needGrowth needSeparatedlyor at the sametime\n17\nHERZBERG",
      "17\nHERZBERG\nwhy some individuals are less (or not at all)frustrated by the fact that they can’t satisfyhigher level needs?\nSome people are frustrated by the organizational constraints, and desire more autonomy and responsibilities\nOther people, however, prefer the tranquility and predictability of routinized jobs"
    ],
    "type": "easy"
  },
 

  {
    "question": "How does mastery relate to intrinsic motivation?",
    "answer": "Progress in skill fuels interest and persistence.",
    "contexts": [
      "used not just as a way to givediscretion in the execution phase, but also in the job design phase.A more balanced approach betweenpersonalizationand coordinationshouldbe pursued in order to create intrinsically motivating jobs.prof. Giovanni Masino University of Ferrara",
      "RELATIONSHIPS& COLLABORATIONWHY IS IT RELEVANT FOR INTRINSIC MOTIVATION?For most people, being involed activities that imply positive relationships, a sense of belonging, community and sharedness represents a reward in itselfIntrinsically motivating jobs should be based, at least to some extent, on collaborative effort, mutual support, teamwork, a sense of “sharedness” (for example, sharing goals and values), reciprocityDO INDIVIDUALS MATTER?YES, different individuals may be more or less",
      "different individuals may be more or less sensitive to the social component of their job. Extroverts, for example, are more intrinsically motivated by collaborative activities thanintroverts(the same is true for more «agreeable» individuals). Otherfactors to consider: background culture, organizational culture, task complexityand several othersHowever, do not underestimate the value of positive relations even for introverts.Significant studies (eg the Harvard Study of Adult Development) show"
    ],
    "type": "easy",
    "answer pages": [
      15,
      16,
      17
    ],
    "document": [
      "08 - Intrinsic Motivation (introduction).pdf"
    ]
  },
  {
    "question": "Why does purpose increase intrinsic motivation?",
    "answer": "Meaning connects work to valued outcomes.",
    "contexts": [
      "TO SUMMARIZEjobs allowing decision making, self-expression and self-determination - in organizations that are psychologically safe and promote initiative, proactivity and authorshipjobs providing task variety, challenges, new experiences, training, knowledge sharing -in organizations that value competence, personal development and learning goalsjobs reflecting individual interests, passions and preferences - in organizations that value a high level of person-job fitjobs relying on",
      "a high level of person-job fitjobs relying on collaboration, mutual support and teamwork - in organizations with a strong sense of community and relationship-oriented leadership and culturejobs perceived as meaningful, impactful, valuable, goal-oriented, emphasizing progress - in organizations where a sense of collective purpose is clearly communicatedprof. Giovanni Masino University of Ferrara",
      "AUTONOMYGROWTH & MASTERYMEANING & PURPOSEPASSIONS & INTERESTSRELATIONSHIPS & COLLABORATIONA FEW KEY RELATIONSHIPS(many others are possible and relevant)IMPACT\n... but there are also potential tensions and tradeoffs\nprof. Giovanni Masino University of Ferrara\n12"
    ],
    "type": "easy",
    "answer pages": [
      20,
      21,
      22
    ],
    "document": [
      "08 - Intrinsic Motivation (introduction).pdf"
    ]
  },
  {
    "question": "How do relationships affect intrinsic motivation?",
    "answer": "Supportive ties boost enjoyment and engagement.",
    "contexts": [
      "13",
      "NEGATIVE CONSEQUENCES AND RISKS OF INTRINSIC MOTIVATION•In very general terms: the negative consequences and risks are FAR LESS significant and consequential than the advantages, and mostly concern peculiar / marginal situations or cases•However, these risks should not be completely ignored–WORK-LIFE INBALANCE•being too passionated about your job may lead to neglect other imporant aspects of life–RISK OF EXPLOITATION•Intrinsically motivated employees may be more likely to accept poor working",
      "may be more likely to accept poor working conditions, lower pay, or heavier workloads because they are driven by passion–RISK OF IGNORING BROADER ORGANIZATIONAL GOALS•Employees who are deeply motivated by their own interests may pursue personal goals at the expense of organizational strategyprof. Giovanni Masino University of Ferrara"
    ],
    "type": "easy",
    "answer pages": [
      25,
      26,
      27
    ],
    "document": [
      "08 - Intrinsic Motivation (introduction).pdf"
    ]
  },
  {
    "question": "What are SDT’s three basic needs?",
    "answer": "Autonomy, Competence, Relatedness.",
    "contexts": [
      "THE COMPANY•3M (Minnesota Mining & Manufacturing)•2023 figures: 33 billion in turnover, 85,000 employees, 70 countries, over 36,000 patents and 50,000 different products (!!), in a wide variety of sectors:•industrial (automotive, design and construction, manufacturing, transport, etc.)•health care•electronics•consumer products•Strategic objective: to achieve at least 30% of turnover from sales of products not older than 4 years\nGiovanni Masino University of Ferrara",
      "Giovanni Masino University of Ferrara\nA LITTLE BIT OF HISTORYFounded in 1902 in Duluth, Minnesotato extract minerals for the purpose of producing sandpapersignificant mistakes and initial difficultiesthe meeting with Francis Okie and the creation of \"Wetordry\", the first great successstill sold today, after more than 100 yearsRichard Drew was hired, and the story of the \"masking tape\" (1925), the \"Scotch“ tape (1930) and the \"bootleg time\" was born",
      "Richard DrewFrancis OkieGiovanni Masino University of Ferrara\n3M'S PHILOSOPHY IN A FEW PHRASES BY WILLIAM MCKNIGHT"
    ],
    "type": "easy",
    "answer pages": [
      11,
      12,
      13
    ],
    "document": [
      "09 - Autonomy and HRM.pdf"
    ]
  },
  {
    "question": "What is autonomy at work?",
    "answer": "Discretion over scheduling, methods, and priorities.",
    "contexts": [
      "ORGANIZATIONAL CULTURE•Strong incentives for mobility–International, Inter-divisional, Inter-Business–This creates an exceptional social network and a remarkable ability to communicate quickly with colleagues from all over the world to find the knowledge is needed•«Dual ladder»–to ensure that technicians and scientists have career opportunities without having to abandon the activities they are passionate about•Symbolic initiatives:–Awards and honors of technical excellence–for example, the",
      "honors of technical excellence–for example, the \"Carlton Society\" (a kind of \"Hall of Fame\" for innovators)•Problem solving missions–Small teams sent to customers to solve their problems–Please note: their goal is not only to provide technical assistance, but to gather ideas and stimuli from customers that can be useful for product development and innovations•Performance evaluation and profit sharing–Performance evaluation includes aspects such as exploration and creativity, not just the",
      "such as exploration and creativity, not just the short-term commercial success of your ideas and proposals  –Profit sharing serves to increase the sense of participation in the overall results of the company"
    ],
    "type": "easy",
    "answer pages": [
      23,
      24,
      25
    ],
    "document": [
      "09 - Autonomy and HRM.pdf"
    ]
  },
  {
    "question": "Name a firm known for bootleg time.",
    "answer": "3M (15% time).",
    "contexts": [
      "THE HISTORY OF POST-IT (2)–Silver and Fry started working together on the idea, the technical aspects and experimented with other potential use cases–However, they were met with skepticism in the company: \"Who would ever want to buy a glue that doesn't glue?\" was the objection they often encountered–1977: experimentation began in various offices, and despite the initial mistrust, gradually people discovered various use cases of the post-it note that not even its creators had imagined–1980: The",
      "that not even its creators had imagined–1980: The product is launched on the market and becomes an iconic product and a decades-long worldwide success–Fry and Silver used extensively their \"bootleg time\" to develop the Post-It, despite the skepticism of many in the company–3M's culture greatly favored and facilitated this path of discovery, creation and experimentation",
      "Giovanni Masino University of Ferrara\nOther examples of companies using policies similar to Bootleg Time–GOOGLE and the \"20% time\"–HEWLETT PACKARD and the \"10% rule\"–ATLASSIAN and the «ShipIt days»–LINKEDIN and the \"Incubator\" programme–APPLE and the \"Blue Sky\" policy –ADOBE and the kickbox program–FACEBOOK (META) and the \"Hackathons\"–IBM and \"Think Fridays\"–VALVE and the \"Free Desk\" policy\nGiovanni Masino University of Ferrara"
    ],
    "type": "easy",
    "answer pages": [
      34,
      35,
      36
    ],
    "document": [
      "09 - Autonomy and HRM.pdf"
    ]
  },
  {
    "question": "What is a risk of high autonomy?",
    "answer": "Coordination and alignment challenges.",
    "contexts": [
      "of creating the conditions for all people in the organization to be and perform at their best",
      "Giovanni Masino University of Ferrara",
      "Other examples: The ROWE approach at BEST BUY•ROWE: Results Only Work Environment•Introduced by BEST BUY (major electronic products mass retailer in the US) in 2003, butabandoned in 2013 after of a change in the top management•employees were givenextensive autonomyabout how to perform their jobs, in allrespects (including location and time); the focus isonly on results(at different levels)•what are the outcomes? According to some studies:–+ 168% in increased productivity–+ 50% in decreased"
    ],
    "type": "easy",
    "answer pages": [
      46,
      47,
      48
    ],
    "document": [
      "09 - Autonomy and HRM.pdf"
    ]
  },
  {
    "question": "What is a common benefit of autonomy?",
    "answer": "Greater innovation and well-being.",
    "contexts": [
      "learning to their schedules, personal pace, and individual needs.•INTEGRATION OF EMPLOYEE FEEDBACK: IBM uses employee feedback to continuously refine its learning offerings. Employees autonomously rate and recommend resources, thereby influencing the quality, relevance, and effectiveness of future learning opportunities.•OUTCOMES: HIGHER EMPLOYEE ENGAGEMENT AND MOTIVATION, ENHANCED SKILL RELEVANCE AND AGILITY, RETENTION AND ATTRACTION, RAPID SKILL DEVELOPMENT",
      "Giovanni Masino University of Ferrara",
      "THE RELEVANCE OF AUTONOMY FOR HRM: A FEW EXAMPLES (3)•CAREER PLANNING AND DEVELOPMENT•Allowing employees autonomy to set personal career goals and define internal career paths•THE GENERAL ELECTRIC EXAMPLE•1. INTERNAL CAREER PLATFORMS (E.G., GE CAREERS PORTAL): GE developed internal online platforms providing transparency on career opportunities across the organization. Employees autonomously explore open roles, rotations, or projects, enabling proactive internal mobilitybased on personal career"
    ],
    "type": "easy",
    "answer pages": [
      57,
      58,
      59
    ],
    "document": [
      "09 - Autonomy and HRM.pdf"
    ]
  },
  {
    "question": "What is unusual about Valve’s structure?",
    "answer": "It has no formal managers.",
    "contexts": [
      "A RECAP OF A FEW POINTS■ Valve is a gaming company, with 400 employees staffers but no traditional management structure, no reporting lines, no job descriptions, no formal meetings■ they hire talented, innovative “self-starters” who decide autonomously which projects they want to join■ The organization operates under the philosophy of “permissionless innovation”, where on small, independent, multidisciplinary teams have complete autonomy on innovative processes (it’s a sort of 100% bootleg",
      "innovative processes (it’s a sort of 100% bootleg time)■ new hires also are encouraged to start new projects so long as they fit the company’s purpose■people are not hired to fill a specific job description, but to look aroundfor the most valuable work they could be doing",
      "prof. Giovanni MasinoUniversity of Ferrara"
    ],
    "type": "easy",
    "answer pages": [
      5,
      6,
      7
    ],
    "document": [
      "10 - The Valve Case Study.pdf"
    ]
  },
  {
    "question": "What does permissionless innovation mean at Valve?",
    "answer": "Employees can join/start projects without approval.",
    "contexts": [
      "the difficulties?if so, where? what about the foreseeable future?prof. Giovanni MasinoUniversity of Ferrara",
      "1. AUTONOMY vs COORDINATION■ “STRUCTURE HAPPENS”: Project teams often have an internal structure that forms temporarily to suit the group’s needs. Although people at Valve don’t have fixed job descriptions or limitations on the scope of their responsibility, they can and often do have clarity around the definition of their “job” on any given day. They, along with their peers, effectively create a job description that fits the group’s goals. That job description changes as requirements change,",
      "job description changes as requirements change, but thetemporary structure provides a shared understanding of what to expect from each other. If someone moves to a different group or a team shifts its priorities, each person can take on a completely different role according to the new requirements”–structure (coordination): ■not ABSENT, but EMERGENT■not FIXED, but TEMPORARY■not FUNCTION ORIENTED, but PROJECT (goal) ORIENTED■not as DIRECTIONS FROM «ABOVE» but as MUTUAL EXPECTATIONS"
    ],
    "type": "easy",
    "answer pages": [
      11,
      12,
      13
    ],
    "document": [
      "10 - The Valve Case Study.pdf"
    ]
  },
  {
    "question": "What challenge arises without managers?",
    "answer": "Informal power and decision overload.",
    "contexts": [
      "2. LEADERSHIP■ traditional view:– LEADERSHIP as the stableimplementation of coordination (through a TOP-DOWN approach)■ with specific, formally defined leadership roles that are “engrained” in the structure■LEADER as the PERSON THAT MAKES DECISIONS about what others have to do to in order to be effective for the organization■ the “Valve” view– LEADERSHIP as the contingentimplementation of coordination (through a BOTTOM-UP, emergent approach)■ by means of shared responsibility based on",
      "by means of shared responsibility based on project-specific competence requirements, project-specific coordination needs and shared mutual expectations■ with the goal of FACILITATING and CREATING the contingent CONDITIONS for effectiveness, efficiency and creativity■LEADER as the PERSON THAT CREATES OPTIMAL CONDITIONS for others to better decide about how to be effective for the organizationprof. Giovanni MasinoUniversity of Ferrara",
      "3. EVALUATING and LEARNING, in Valve■MISTAKES: Nobody has ever been fired at Valve for making a mistake. It wouldn’t make sense for us to operate that way. Providing the freedom to failis an important trait of the company. However, there are still some bad ways to fail. ■1) Repeating the same mistake over and over■2) Not listening to customers or peers before or after a failure■3) Ignoring the evidence; particularly when it says you’re wrong■PEER EVALUATIONS: There is a framework for how we"
    ],
    "type": "easy",
    "answer pages": [
      16,
      17,
      18
    ],
    "document": [
      "10 - The Valve Case Study.pdf"
    ]
  },
  {
    "question": "What is a key lesson from Valve?",
    "answer": "Balance autonomy with coordination mechanisms.",
    "contexts": [
      "desirable consequence of a true orientation to innovation and problem solving■ an opportunity for learning and growing (individually and collectively), thanks to a verylearning-oriented, future-oriented, peer-drivenFEEDBACK POLICY and CULTURE–a «BAD MISTAKE»■ it’s the outcome of undesirable behavior and attitudes: not learning from experience, insufficient effort, ignoring facts and evidence–it is a FUTURE-ORIENTED management of initiative and autonomyprof. Giovanni MasinoUniversity of Ferrara",
      "4. HIRING, in Valve■ We value highly collaborative people, who can deconstruct problems on the fly, and talk to others as they do so, simultaneously being inventive, iterative, creative, talkative, and reactive■These things actually matter far more than deep domain-specific knowledge or highly developed skills in narrow areas. This is why we’ll often do NOT hire candidates who, narrowly defined, are the “best” at their chosen discipline■We value “T-shaped” people. That is, people who are both",
      "“T-shaped” people. That is, people who are both generalists (highly skilled at a broad set of valuable things—the top of the T) and also experts(among the best in their field within a narrow discipline—the vertical leg of the T)–PLEASE NOTICE: Valve puts at least as much emphasis (if not MORE) on CULTURAL FIT(between the company and the new hires) as to COMPETENCE and TALENT"
    ],
    "type": "easy",
    "answer pages": [
      22,
      23,
      24
    ],
    "document": [
      "10 - The Valve Case Study.pdf"
    ]
  },
  {
    "question": "How do employees choose projects at Valve?",
    "answer": "Self-selection based on interest and impact.",
    "contexts": [
      "ISSUES and CRITICISMS (again, this is not just about Valve)1.While the formal hierarchy is “flat”, informal hierarchies do emerge •Senior employees, influential voices, and founders can still dominate decision-making, even without formal titles•Notice: this can be both a good thing (coordination is always essential!!)and a bad thing (power is just a tool: the outcomes depend on how it is used)2.Former employees have said that Valve’s \"sink or swim\" culture is especially difficult for new",
      "or swim\" culture is especially difficult for new hires•Without a clear project, manager, or support structure, new hires and/or less assertive people may struggle•That is why they put a lot of emphasis on “cultural fit” of new employees3.Peer reviews, stack ranking evaluations may foster “popularity contests” and “politics” rather than pure merit.•former employees said that being unpopular or socially distant can damage one's standing, regardless of performance",
      "prof. Giovanni MasinoUniversity of Ferrara"
    ],
    "type": "easy",
    "answer pages": [
      27,
      28,
      29
    ],
    "document": [
      "10 - The Valve Case Study.pdf"
    ]
  },
  {
    "question": "What is job crafting?",
    "answer": "Employee-initiated changes to tasks, relationships, or meaning.",
    "contexts": [
      "value»so, standardizing as much as possible the activity allows to maximizie productivity (customer served per time unit) and minimize personnel cost»the emerging use of chatbots to replace humans in customer service is another example of the same logic•Zappos takes a very different approach",
      "prof. Giovanni MasinoUniversity of Ferrara",
      "Customer service in Zappos•applicants for call centers are provided basic training for about 10 days before beinghired; after training, if some criteria are met, an offer is made:•they can accept to work for Zappos•CRUCIAL CRITERIA: cultural «fit» (just like Valve)•or, they can deny the offer, and in that case they are compensated with 2000$for the time theydevoted to training•the incentive is used to reward people for NOT staying with Zappos!!! WHY???•the goal is to make sure that hired people"
    ],
    "type": "easy",
    "answer pages": [
      12,
      13,
      14
    ],
    "document": [
      "11 - Job Crafting.pdf"
    ]
  },
  {
    "question": "Name the three types of job crafting.",
    "answer": "Task, relational, and cognitive crafting.",
    "contexts": [
      "access to a lot of «hidden value» from autonomous employees•Of course, the right conditionsneed to be present•What concept can we use in order to better understand how and why thesebenefits are possibile?prof. Giovanni MasinoUniversity of Ferrara",
      "JOB CRAFTINGCambridge Dictionary: the activity or hobby of making decorative objects with your handsWhat does the word \"craft\" / \"crafting\" mean?LanGeek Dictionary –What is \"crafting\" in video games?Crafting in video games refers to the process of creating new items or equipment by combining different resources in the game. Players can collect raw materials, such as wood, metal, or herbs, and use them to craft weapons, armor, potions, or other useful items. Crafting systems allow players to",
      "useful items. Crafting systems allow players to upgrade their skills, customizetheir gear, or improve their chances of successThe definition from the world of video games is the one that comes closest to the concept of \"job crafting\", let's see why...prof. Giovanni MasinoUniversity of Ferrara"
    ],
    "type": "easy",
    "answer pages": [
      24,
      25,
      26
    ],
    "document": [
      "11 - Job Crafting.pdf"
    ]
  },
  {
    "question": "What is the Job Characteristics Model?",
    "answer": "A model linking core job features to motivation.",
    "contexts": [
      "«APPROACH» JOB CRAFTING«AVOIDANCE»JOB CRAFTINGprof. Giovanni MasinoUniversity of Ferrara",
      "Job Crafting and Job DesignIn what situations is job crafting observed? always (except in extreme situations) albeit in different sizes and waysIn any job, task, activity, people always tend, at least in part, as far as they can, to \"appropriate\" the work, that is, to act in a discretionary way that may go “beyond” the formal job description.Remember Deci’s SELF DETERMINATION THEORYIn some cases these changes are small, insignificant details, in other cases they concern aspects of the work",
      "in other cases they concern aspects of the work that are quite consequentialJob crafting can take place:without the management’s awareness(or even againstmanagement’s will)the management is aware of this and simply \"tolerates\" these behaviors(more rarely, for now) with the management’ encouragementand facilitationJob Crafting can be seen as a sort of \"Co-Job Design\" (i.e. a job design in which both the workers and management contribute to the definition of work activities), which attempts"
    ],
    "type": "easy",
    "answer pages": [
      36,
      37,
      38
    ],
    "document": [
      "11 - Job Crafting.pdf"
    ]
  },
  {
    "question": "How does crafting affect engagement?",
    "answer": "It aligns work with motives and strengths.",
    "contexts": [
      "JOB CRAFTING and ORGANIZATIONAL ANTECEDENTSTASK CHARACTERISTICSORGANIZATIONAL AND HR POLICIESLEADERSHIP\nfrom available empirical literatureNOTICE: these are AVERAGE results. Every single case may be different.\nprof. Giovanni MasinoUniversity of Ferrara",
      "•WHY JOB CRAFTING DOES NOT GENERATE NEGATIVE EFFECTS ON COORDINATION and, by consequence, NEGATIVE PERFORMANCE OUTCOMES?•When they are able to \"craft\" their work, people tend to increase their \"person-job fit\". Work becomes more intrinsically motivating. By consequence:1.Individualperformance improves because the job becomes more consistent with the individual’s skills, interests, passions, knowledge2.Organizationalperformance improves because the individuals have no interest in taking action",
      "the individuals have no interest in taking action that will damage a work environment that they consider satisfactory and intrinsically motivating–A sort of virtuous cycle can be enacted: the more I craft my job, the more I like it, the more I want to preserve this positive situation, the more I craft my job in a way that will be accepted and legitimized by others (colleagues, leaders)–Therefore, it becomes an individuals’ interest to try to craft (change) their work in ways and areas where"
    ],
    "type": "easy",
    "answer pages": [
      48,
      49,
      50
    ],
    "document": [
      "11 - Job Crafting.pdf"
    ]
  },
  {
    "question": "What service example shows high discretion?",
    "answer": "Zappos agents without strict scripts.",
    "contexts": [
      "•Some very early data on «Job Crafting Interventions»–empirical studies in which the company agrees to follow a specifi job crafting protocol throughwhich employees are instructed and encouraged to increase their job crafting behaviors, in order to evaluate the outcomes•RESULTS: mostly positive, with some heterogeneity–largely, job crafting interventionsincrease the job crafting behaviors(as expected)•more often than not, job crafting behaviors that are increased by intervention studies concern",
      "are increased by intervention studies concern the job demands(less so the job resources)–probably because of how protocols are designed: for example, several protocols put emphasis on job crafting behaviors aimed at «decreasing hindering demands»–on average, job crafting interventionsincrease performance•however, it is useful to separate:–TASK performance»the individual performance in relation to the specific, assigned task–ADAPTIVE performance»the individual performance in terms of ability to",
      "individual performance in terms of ability to adapt to new circumstances–CONTEXTUAL performance»the individual performance in terms of contribution to the group / organization»Interestingly, on average, intervention studies show a more significant increase in CONTEXTUAL PERFORMANCE(as compared to TASK and ADAPTIVE)"
    ],
    "type": "easy",
    "answer pages": [
      60,
      61,
      62
    ],
    "document": [
      "11 - Job Crafting.pdf"
    ]
  },
  {
    "question": "Which goals best raise performance?",
    "answer": "Specific and difficult goals.",
    "contexts": [
      "WHY DOES THIS WORK?•Focus•specific, high goal orients an individual’s attention toward goal-relevant activities and away from those that are deemed by that individual to be irrelevant•Effort•effort and arousal vary with the demands (difficulty) of attaining the goal•a challenging goal makes self-satisfaction contingent on a high level of performance•Persistence•a specific, challenging goal leads people to be more persistent than vague, easy goals•Strategy•a specific, challenging goal activates",
      "specific, challenging goal activates the available knowledge and skills (strategies) that are necessary to attain the goalprof. Giovanni Masino – Università di Ferrara",
      "8"
    ],
    "type": "easy",
    "answer pages": [
      9,
      10,
      11
    ],
    "document": [
      "12 - Goal Setting.pdf"
    ]
  },
  {
    "question": "Who developed Goal Setting Theory?",
    "answer": "Locke and Latham.",
    "contexts": [
      "SITUATIONAL FACTORS: PARTICIPATION in GOAL SETTING•ASSIGNEDgoals can be as effective as PARTICIPATIVEand SELF-SETgoals, depending on the context•ASSIGNEDgoals are more effective when•Rapid alignment is required, as they lead to quicker compliance•Routine and repetitive tasks, as they provide clearer direction•Time critical situations, where rapidity is essential•When strict compliant to procedures and standards is necessary•PARTICIPATORY goal setting may have significant advantges in several",
      "setting may have significant advantges in several circumstances•notice: AUTONOMY and PURPOSE have a synergistic effect•it is better suited for complex, creative, long term, tasks•it helps understandinghow to perform the task•it increases the sense of «ownership» of the task•it increases alignmentwith personal goals and values•DISADVANTAGES:•it can generate over-ambitious goals(because of over-confidence) or goals that are too easy (when goal achievement is attached to a desirable",
      "(when goal achievement is attached to a desirable incentive)prof. Giovanni Masino – Università di Ferrara"
    ],
    "type": "easy",
    "answer pages": [
      18,
      19,
      20
    ],
    "document": [
      "12 - Goal Setting.pdf"
    ]
  },
  {
    "question": "When prefer learning goals over performance goals?",
    "answer": "When acquiring new or complex skills.",
    "contexts": [
      "to be public.–Employees should create most of their own key results, whether the objective comes from the top or not",
      "The OKR (Objectives and Key Results) approach: IMPLEMENTATION (2)–Step 3: Decide on the length of your OKR cycle. •Your team should operate on the same goal-setting schedule, or OKR cycle. For most companies, there are two simultaneous OKR cycles, quarterly and annual. Annual cycles are for long-term OKRs, and quarterly cycles are for short-term OKRs that support the longer-term objectives.–Step 4: Designate an “OKR shepherd.” •It is common to encounter resistance and procrastination. It’s",
      "to encounter resistance and procrastination. It’s useful to put someone in charge of keeping the rest of the team or organization accountable for setting and working toward their OKRs.–Step 5: Set stretch goals. •Eventually, in addition to “committed OKRs” (objectives that must be met for your company to function and thrive), you should create “stretch OKRs,” objectives that are very ambitous. Stretch OKRs push you to achieve more than you thought possible.–Step 6: Check in with employees"
    ],
    "type": "easy",
    "answer pages": [
      28,
      29,
      30
    ],
    "document": [
      "12 - Goal Setting.pdf"
    ]
  },
  {
    "question": "Name two goal moderators.",
    "answer": "Feedback and commitment.",
    "contexts": [
      "task environment) are more productive when they experience a positive «inner work life» - they are intrinsically motivated, they feel happy, have a positive perceptions of colleaguesand their organizations–inner work life, however, may vary greatly from day to day (and performance as well)–WHAT ELEMENTS AFFECT INNER WORK LIFE THE MOST?•the sense of «PROGRESS»(both at individual or group level) is, by far, the most inlfuential elements•Progress influence all components of positive inner work",
      "influence all components of positive inner work life–more positive emotions–more intrinsic motivation (interest and enjoyment in work itself)–more positive perceptions about others17",
      "GOOD DAYS and BAD DAYS\nPROGRESS vs SETBACKeven small progress or achievementsCATALYST vs INHIBITORScatalysitas actions or eventsthat support work activities(help from others etc)inhibitorsas actions or events tthat do not supportor hinder workNOURISHERS vs TOXINSNourishersas events or signof respect, encouragementetc.Toxinsas discouraging or undermining events"
    ],
    "type": "easy",
    "answer pages": [
      37,
      38,
      39
    ],
    "document": [
      "12 - Goal Setting.pdf"
    ]
  },
  {
    "question": "What is goal participation?",
    "answer": "Involving employees in setting goals.",
    "contexts": [
      "the REACHABILITYof that goal: progressis also interpreted as a measure of how close or distant we are from reaching the goal, which is a proxy for the «reachability» of the goal•NOTICE: these two elements are relatively independent:»even when we have made little progress, but we put significant effort, we feel more motivated, because of the increased perception of goal value»even when we have put little effort, but we have made significant progress, we feel more motivated, becausewe feel closer",
      "we feel more motivated, becausewe feel closer to goal achievement",
      "EFFORT and PROGRESSPROGRESSGOALThe more progress, the more effort we have devoted to the goal, the more we infer that the goal is valuableThe more progress, the closer the goal, the more reachablethe goal becomesWe look backWe look forward"
    ],
    "type": "easy",
    "answer pages": [
      46,
      47,
      48
    ],
    "document": [
      "12 - Goal Setting.pdf"
    ]
  },
  {
    "question": "What is a growth mindset?",
    "answer": "Belief that abilities can be developed.",
    "contexts": [
      "CONTEXT-DEPENDENCY of MINDSETS•WHAT FACTORS INFLUENCE THE CONTEXT-DEPENDENCY OF MINDSETS?•Self-Efficacy and Perceived Competence:–People with higher self-efficacyin a specific area tends to cultivate a growth mindsetfor that domain–People with lower self-efficacy(or previous negative experiences) tend to develop a fixed mindsetin that domain•Intrinsic vs. Extrinsic Motivation:–Intrinsically motivating, autonomous tasksusually encouragegrowth mindset(through exposure to experimentation,",
      "mindset(through exposure to experimentation, challenge-seeking, development opportunities etc)–Extrinsically motivating or imposed tasksmay encourage or reinforcefixed mindsetdue to fear of failure or performance pressures•Environmental Feedback and Contextual Cues:–Encouraging and supportive environments(teachers, coaches, leaders, supervisors, organizations emphasizing effort, learning, and process) typically nurture context-specific growth mindsets.–Critical or performance-driven",
      "growth mindsets.–Critical or performance-driven environments(emphasizing innate talent or immediate success) foster fixed mindsetswithin those specific contexts."
    ],
    "type": "easy",
    "answer pages": [
      23,
      24,
      25
    ],
    "document": [
      "13 - Growth.pdf"
    ]
  },
  {
    "question": "What is a fixed mindset?",
    "answer": "Belief that abilities are largely static.",
    "contexts": [
      "HOW TO DEVELOP A GROWTH MINDSET (1)–Reframe Challengesas Opportunities•When encountering difficulty, consciously remind yourself: \"This is an opportunity for me to grow, not a threat to my competence“•Replace negative internal dialogue (\"I'm just not good at this\") with curiosity-driven statements (\"I’m still learning this\")–Set Learning Goals(Not Performance Goals)•Prioritize goals oriented toward personal growth and mastery rather than just grades or external validation.•Example: \"I want to",
      "or external validation.•Example: \"I want to learn about this” instead of \"I must get a 30 grade at all costs“–Normalize Effortand Persistence•Explicitly acknowledge effort as essential and valuable, rather than a sign of insufficient talent.•Develop rituals and habits that reinforce the value of regular effort•Dedicate specific daily or weekly time slots to challenging but meaningful activities–Learn from Mistakes and Embrace Feedback•View mistakes as valuable information rather than",
      "mistakes as valuable information rather than failures.•When receiving criticism pause, listen actively, and ask yourself: \"How can I use this feedback to improve?”•Consider journaling mistakes and feedback received, explicitly identifying lessons learned"
    ],
    "type": "easy",
    "answer pages": [
      47,
      48,
      49
    ],
    "document": [
      "13 - Growth.pdf"
    ]
  },
  {
    "question": "Who popularized growth mindset?",
    "answer": "Carol Dweck.",
    "contexts": [
      "30",
      "A FEW CONNECTIONS WITH PREVIOUS LESSONS (1)•GROWTH MINDSET and JOB CRAFTING–just few studies available–a growth mindset increases people’s propensity to craft their job•GM encourages to see JC as a way to experiment, explore and improve–a FM has the opposite effect (especially for «expansive» JC)•However, a FM may encourage certain kinds of «avoidance» JV–the relationship is likely to be bidirectional•successful JC may help to understand one’s potential for improvement and growth and, by",
      "potential for improvement and growth and, by consequence, to embrace a GM•GROWTH MINDSET and the PROGRESS PRINCIPLE–Amabile’s progress principle: experiencing progress in meaningful work improves positive emotions about work, motivation, engagement •the opposite happens with setbacks–Growth mindset promotes the perception of the relevance and possibility of progress (seen as learning and improvement), promotes persistence (which increases the possibility of progress), helps interprets setbacks"
    ],
    "type": "easy",
    "answer pages": [
      71,
      72,
      73
    ],
    "document": [
      "13 - Growth.pdf"
    ]
  },
  {
    "question": "How does growth mindset affect learning?",
    "answer": "Encourages persistence and feedback use.",
    "contexts": [
      "40",
      "PIXAR’s «Braintrust»•KEY PRINCIPLES•Braintrust, a regular peer-feedback meetings for creative seniors (leaders and crative directors) at key milestones of the film production process•No authority structure in the room: particpiants are not obliged to follow advice.•The goal is not to dictate solutions but to surface problemsand spark better ideas.•Radical candor is balanced with respect: the culture is \"candid but supportive“•GOALS:•Tackle and solve high-level storytelling and creative",
      "and solve high-level storytelling and creative problems•Help directors and creative leads see blind spots and improve their films"
    ],
    "type": "easy",
    "answer pages": [
      95,
      96,
      97
    ],
    "document": [
      "13 - Growth.pdf"
    ]
  },
  {
    "question": "Name one way to build growth mindset.",
    "answer": "Celebrate small wins and learning progress.",
    "contexts": [
      "groups, participate in events, and engage in discussions to enhance their learning experience.",
      "47",
      "The TRAILHEAD platform at Salesforce: POLICIES and PRACTICES (2)•Mentorship and Networking: The community aspect of Trailhead allows users to connect with mentors and industry experts, providing valuable networking opportunitiesand guidanceon career development.•Executive Participation: Salesforce leaders actively participate in Trailhead initiatives. By engaging with the platform themselves, leaders demonstratethe importance of continuous learning and encourage employeesto follow"
    ],
    "type": "easy",
    "answer pages": [
      119,
      120,
      121
    ],
    "document": [
      "13 - Growth.pdf"
    ]
  },
  {
    "question": "What is conformity?",
    "answer": "Adjusting behavior or opinions to align with a group.",
    "contexts": [
      "17\nHow do social norms emerge?•The Waiting Room example",
      "18",
      "BIG FIVE PERSONALITY TRAITS AND CONFORMITY1.Individuals high in conscientiousnessare less likely to conform to group norms, as they tend to be self-disciplined and prefer to make decisions based on their own principles rather than following others2.People high in opennessare less likely to conform, as they tend to be imaginative, creative, and independent-minded3.People high in extravertionare more likely to conform to group norms, as they tend to seek social approval and enjoy social"
    ],
    "type": "easy",
    "answer pages": [
      11,
      12,
      13
    ],
    "document": [
      "14 - Conformity.pdf"
    ]
  },
  {
    "question": "Which experiment showed line-judgment conformity?",
    "answer": "Asch’s experiment.",
    "contexts": [
      "GROUP SIZE\nhowever, recent studies show that the majority size does affect conformity more thanwhat Asch-like experiments suggested\nfrom Asch’s studies:\nSIZE OF THE MAJORITY\n23",
      "from Asch’s studies:\nSIZE OF THE MAJORITY\n23\n-THE LARGER THE MAJORITY , THE STRONGER THE SIGNAL- theunderlying principle is not irrational!- The larger the majority, the more I may rationally think that othershave better information than me- however, in some circumstances, justthe presence of even a singledissenter may change significantly the degree of conformity-This is not necessarily a negative effect - quite the contrary (as wewill see in group dynamics)",
      "- EXAMPLE: Harrington (2008) shows that the worstperforming investments clubs were the ones with affectiveties (high social conformity, unanimous votes, littlediscussion), while the best performing clubs had limitedsocial connections (low conformity, discussion, criticalthinking unconstrained by social cohesion)\nSTATUS\n24"
    ],
    "type": "easy",
    "answer pages": [
      23,
      24,
      25
    ],
    "document": [
      "14 - Conformity.pdf"
    ]
  },
  {
    "question": "What is normative conformity?",
    "answer": "Conforming to be liked or accepted.",
    "contexts": [
      "27",
      "A FEW EXAMPLES: NORMATIVE CONFORMITY (2)•You work in a sales department where team members regularly exaggerate product capabilities when talking to clients. You find this uncomfortable and ethically dubious•But during team meetings and informal chats, everyone jokes about “stretching the truth” as just part of the job•You don’t speak up and eventually adopt the same language when talking to clients—not because you think it’s right, but because you don’t want to be seen as a troublemaker or",
      "you don’t want to be seen as a troublemaker or outsider•You're conforming to avoid social disapproval or exclusion, not because you believe the practice is right.•You experience internal discomfort (ethical dissonance), but maintain the behavior•Notice the “ethical” component"
    ],
    "type": "easy",
    "answer pages": [
      34,
      35,
      36
    ],
    "document": [
      "14 - Conformity.pdf"
    ]
  },
  {
    "question": "What is informational conformity?",
    "answer": "Conforming for accuracy under uncertainty.",
    "contexts": [
      "Results•G1: avg. right answers: 32.6•G2: avg. right answers: 36.2•G3: avg. right answers : 35.9•G4: avg. right answers : 36.1•Differences are due not to a small number of “big cheaters”, but to many “small cheaters”•When chances to be busteddecrease(or are canceled) things don’t change•Notice: honest / dishonest behavior does NOT depend on a rational cost-benefit analysis (otherwise, group 4 would cheat more than the others!!)•Similar experiments show similar resultsGiovanni Masino - University",
      "show similar resultsGiovanni Masino - University of Ferrara",
      "NO CHEATINGSMALL CHEATINGSMALL CHEATINGSMALL CHEATING"
    ],
    "type": "easy",
    "answer pages": [
      46,
      47,
      48
    ],
    "document": [
      "14 - Conformity.pdf"
    ]
  },
  {
    "question": "Name a factor that increases conformity.",
    "answer": "Group cohesiveness.",
    "contexts": [
      "Conformity and ethics (2)•CONFORMITY INCREASES WHEN:•The group normalizesquestionable behavior through shared justifications (e.g., “everyone does it”)•Remember the Wells-Fargo case•Ethical norms are reframed as business pragmatism(“It’s not unethical, it’s strategic”)•The ethical violation is ambiguous or abstract(“gray area” ethics)•People defer responsibility to authorityfigures or the system (e.g., “I was just following orders”)•More on this later, when we talk about obedience•There is fear",
      "later, when we talk about obedience•There is fear of retaliation or exclusionfor speaking out",
      "OTHER FACTORS INFLUENCING CONFORMITY\n38"
    ],
    "type": "easy",
    "answer pages": [
      57,
      58,
      59
    ],
    "document": [
      "14 - Conformity.pdf"
    ]
  },
  {
    "question": "Name Cialdini’s core principles.",
    "answer": "Liking, Unity, Consistency, Scarcity, Social Proof, Authority.",
    "contexts": [
      "9",
      "LIKING: what about difference? (1)•can the opposite be also true?•in other words, can a perceived difference, insteadsimilarity, induce liking and, by consequence, more probability to be influenced or persuaded?•Yes, but with some conditions. Typical mechanisms:1.Admiration-Based Attraction–If a person is perceived as different in a positive, admirableway, that difference can trigger respect, curiosity, and aspiration.–This emotional engagement can lead to liking, deference, and greater",
      "can lead to liking, deference, and greater openness to influence–Key Mechanism: it's not \"they're like me,\" but rather \"I admire them for being what I would like to be\""
    ],
    "type": "easy",
    "answer pages": [
      16,
      17,
      18
    ],
    "document": [
      "15 - Social Influence and Persuasion.pdf"
    ]
  },
  {
    "question": "What is the liking principle?",
    "answer": "People are more influenced by those they like.",
    "contexts": [
      "CONSISTENCY: persuasion techniques–The «foot in the door» tecnhique•The «seller» asks something extremely small, which almost certainly will be accepted. Then, later, makes a more significant request which appear to be consistent with the first one.•(Pliner et al): the «pin» example at the mall•The «lowball» technique–a very attractive initial offer is mode in order to commit a potential customer into it, and then making the offer less favorable (e.g., increase the price of the product or",
      "(e.g., increase the price of the product or service)–In meetings:–In a team meeting, the leader asks participants to say out loud that they support a project. Later, even when difficulties arise, those who voiced their support are more likely to stick with the plan",
      "17"
    ],
    "type": "easy",
    "answer pages": [
      33,
      34,
      35
    ],
    "document": [
      "15 - Social Influence and Persuasion.pdf"
    ]
  },
  {
    "question": "What does scarcity imply?",
    "answer": "Limited opportunities seem more valuable.",
    "contexts": [
      "22\nExamples from advertising\nGiovanni Masino - University of Ferrara",
      "23\nUNITYWE ARE MORE EASILY INFLUENCED OR PERSUADED BY OTHERS IN SITUATIONS IN WHICH WE PERCEIVE THAT WE SHARE A DEEP COMMON IDENTITY\n24",
      "UNITY: definition•WE ARE MORE EASILY INFLUENCED OR PERSUADED BY OTHERS IN SITUATIONS IN WHICH WE SHARE A COMMON IDENTITY•It's about more than just “liking” someone. It’s about “merging” the self with others in a meaningful way•different factors that activate a sense of unity:•Kinship: –Actual family ties, but also metaphorical family language (\"brother,\" \"sister,\" \"our family of customers\")•Shared groups: –Same hometown, same religion, same sports team, same alma mater, etc•Shared experience:"
    ],
    "type": "easy",
    "answer pages": [
      50,
      51,
      52
    ],
    "document": [
      "15 - Social Influence and Persuasion.pdf"
    ]
  },
  {
    "question": "What is social proof?",
    "answer": "Looking to others’ behavior as a guide.",
    "contexts": [
      "30",
      "SOCIAL VALIDATION and «nudging»–Social validation is one of the most powerful tools to influence behavior within the “Nudging” (choice architecture) approach•However, we should be careful because sometimes social validation can function as a way to legitimize undesired behavior. For example:–The Petrified Forest National Park (in Arizona) had a problem with visitors stealing pieces of petrified wood. They tested two signs:•Social proof message (\"Many past visitors have removed wood from the",
      "(\"Many past visitors have removed wood from the park, changing the state of the Petrified Forest\")•No social proof message(“Please don't remove wood\").WHAT DO YOU THINK THE RESULT WAS? WHAT MESSAGE WAS MORE EFFECTIVE?•Ironically, the social proof message increased theft, because it unintentionally normalized stealing (\"everyone's doing it\")•Lesson: social proof works, but it needs to show positive, desired behavior, not undesired behavior"
    ],
    "type": "easy",
    "answer pages": [
      67,
      68,
      69
    ],
    "document": [
      "15 - Social Influence and Persuasion.pdf"
    ]
  },
  {
    "question": "What is the authority principle?",
    "answer": "Following credible experts or leaders.",
    "contexts": [
      "37",
      "Outcomes•65% of people administered 450 v. shocks•100% administered shocks labeled as «intense» or «extremely intese»•Over 80% administered shocks even after hearing screams of pain from the other room•All of them objected in various ways•Many participants showed extreme signs of stress: sweating, trembling, nervous laughter, even seizures–VARIATIONS•if the researcher (authority figure) exits the room (or gives instructions by phone), obedience is reduced•with 2 fake «rebel collaborators»,",
      "is reduced•with 2 fake «rebel collaborators», extreme obedience is reduced to 10%•with 2 fake «non rebel collaborators», extreme obedience increases to 92%•When moved from Yale University to a common office building, obedience decreased•The study was replicated in the US in 2006 and in other countries (Germany, Australia, Jordan, South Africa) with very similar resultsGiovanni Masino - University of Ferrara"
    ],
    "type": "easy",
    "answer pages": [
      84,
      85,
      86
    ],
    "document": [
      "15 - Social Influence and Persuasion.pdf"
    ]
  },
  {
    "question": "What is reciprocity?",
    "answer": "Returning favors or concessions.",
    "contexts": [
      "7",
      "Examples and techniques•Marketing and Sales:–Free samples: Companies often give free samples because receiving something \"for free\" increases the likelihood that consumers will feel compelled to buy something.–Gifts: charities might send small gifts along with donation requests•Disabled American Veteran Association duobled their received donations when theyattached to the request letter a small gift•even small or purely symbolic gifts: in some cases, the answering % more than doubledwhen the",
      "cases, the answering % more than doubledwhen the request was accompanied by a hand-written post-it–The «door in the face» technique•the «seller» starts with a very high request, which is refused, then the request is lowered: a «favor» is faked in order to stimulate the obligation to reciprocate•many examples in fund raising, blood donation and other contexts•REQ. 1: Would you please serve as unpaid counselor for juvenile delinquents 2 hours a week for the next 2 years?–Nobody accepts•REQ. 2:"
    ],
    "type": "easy",
    "answer pages": [
      10,
      11,
      12
    ],
    "document": [
      "16 - Reciprocity.pdf"
    ]
  },
  {
    "question": "What is door-in-the-face?",
    "answer": "Start high, then retreat to a smaller request.",
    "contexts": [
      "RECIPROCITY: a wide variety of examples: NATURE (1)•Bats often fail to find enough food during a night, and missing two consecutive meals can be fatal.•In some species, individual bats that found food, at the end of the hunt regurgitate part of it to feed bats who failed — even when they are not direct kin (not close relatives)•these acts of sharing are selective: bats are much more likely to help those who previously shared with them.–they remember who has helped them before (individual",
      "remember who has helped them before (individual recognition)–they punish bats who consistently fail to reciprocate by stopping to help them.•Food sharing is individually costly in the short term, but losing a small amount of food today is better than dying later. Reciprocity increases survival chances for all involved, especially in a small stable group",
      "15"
    ],
    "type": "easy",
    "answer pages": [
      20,
      21,
      22
    ],
    "document": [
      "16 - Reciprocity.pdf"
    ]
  },
  {
    "question": "Why is reciprocity universal?",
    "answer": "It is a widely shared social norm.",
    "contexts": [
      "19",
      "IN MANAGEMENT and in the ECONOMY•In a group or a team (or in the whole company ..)–every member knows that a high level of individual effort generates a good outcome for both the group (organization) and for each invididual(Coop-Coop)–however, each member is interested in decreasing effort and gain the outcome generated by the effort of others (Def-Coop)–if all members reduce their efforts to the minimum level necessary (in order not to be busted and sanctioned), the overall outcome of the team",
      "and sanctioned), the overall outcome of the team / company becomes very poor (Def-Def)•in Knowledge Management –The collective interest to knowledge sharing (Coop-Coop)–The individual interest in retaining valuable knowledge and accessing others’ knowledge (Def-Coop)–The organizational failure if knowledge is not widely shared (Def-Def)"
    ],
    "type": "easy",
    "answer pages": [
      30,
      31,
      32
    ],
    "document": [
      "16 - Reciprocity.pdf"
    ]
  },
  {
    "question": "How does reciprocity support teams?",
    "answer": "It builds trust via mutual help.",
    "contexts": [
      "is intent-based: it targets unfair intentions or actions, even more than unequal outcomes",
      "25",
      "Contextual factors•CULTURE–a number of cultural dimension affect, to some extent, our spontaneousorientation to cooperation•E.g. individualistic vs collectivistic, power distance, tightness vs looseness•FRAMING–example:•Gain frame: “I’m offering you €2 out of €10”•Loss frame: “I’m keeping €8 of our €10”•Which one do you think is more likely to be rejected by the responder?–other examples:•the offer is framed as being “EARNED”, rather than just attributed for no reason or by luck•proposers are"
    ],
    "type": "easy",
    "answer pages": [
      40,
      41,
      42
    ],
    "document": [
      "16 - Reciprocity.pdf"
    ]
  },
  {
    "question": "Name a marketing tactic using reciprocity.",
    "answer": "Free samples.",
    "contexts": [
      "28\nAXELROD’s TOURNAMENTFIRST TOURNAMENT: TIT for TAT is the winner (Anatoli Rapoport)SECOND TOURNAMENT: (63 participants from 6 countries):TIT for TAT is, again, the winner (Anatoli Rapoport)EXAMPLES OF STRATEGIES\nCDTIT FOR TATRANDOMCCDCCCCCDCDDDCCCCCCDCCCCCCCDCDDCCCCCCCTIT FOR 2 TATSRANDOMCDFRIEDMANNCCCCCDDDDCCCDDDDDCRANDOM\n29",
      "AXELROD’s TOURNAMENT•The characteristics of the TIT for TAT strategy (and all other similar successful strategies)1.GOODThe first move is cooperative2.PUNISHINGDefection is “punished” with defection: defection must not be encouraged or rewarded3.FORGIVINGA certain degree of \"patience\" avoids spirals of defections, and encourages cooperation4.CLEAR / TRANSPARENTIf the strategy is not comprehensible to others, and therefore there is not enough expectation of cooperation, there is a risk of",
      "expectation of cooperation, there is a risk of leading to defectionTHIS STRATEGY IS VERY, VERY SIMILAR TO THE “SPONTANEOUS” ATTITUDE OF MOST PEOPLE, IN MOST SITUATIONS!"
    ],
    "type": "easy",
    "answer pages": [
      50,
      51,
      52
    ],
    "document": [
      "16 - Reciprocity.pdf"
    ]
  },
  {
    "question": "How can HR use social proof?",
    "answer": "Report high participation rates to nudge adoption.",
    "contexts": [
      "to increasing representation of underrepresented groups and shared internal data showing where progress was made•Employees saw in-group behavior shifting, which nudged further support and participation in inclusion efforts.•In team meetings, managers consistently use inclusive language and gently correct exclusionary jokes. Over time, others conform to this inclusive behavior to fit in socially, not just because of a formal policy•Encouraging Participation in Voluntary HR Programs–In some",
      "Participation in Voluntary HR Programs–In some corporate wellness programs, participation rates jumped when HR posted a message emphasizing a high participation rate, like: “74% of employees in your department have already completed their health screening”•Potential dangers and risks–conformity can be very powerful to spread both positive, useful norms, but also negative, undesirable norms. Only desirable norms should be made salient!•remember the Wells-Fargo case",
      "5"
    ],
    "type": "easy",
    "answer pages": [
      4,
      5,
      6
    ],
    "document": [
      "17 - Social Influence and HRM (examples).pdf"
    ]
  },
  {
    "question": "What did Bechtel feature in ethics training?",
    "answer": "Stories of colleagues reporting misconduct.",
    "contexts": [
      "6",
      "LIKING and HRM: examples•Peer-Led Onboarding Programs–A company assigns new employees to an onboarding \"buddy\"chosen partly for shared interests (e.g., hobbies, education, values)•This may boost early social connection, reducing stress and improving retention•Effective Leadership–Google found that one of the top traits of effective leaders was being “a good coach” and “showing interest in team members’ success and well-being”–plenty of research data on LMX(leader-member exchange): leaders that",
      "data on LMX(leader-member exchange): leaders that are more capable at using empathy, active listening, finding common ground, providing feedback, helping etc tend to generate a number of positive outcomes in their group and teams•Internal Recruitment & Referrals–Many companies use employee referral programs to find new hires–Referrals tend to perform better and stay longer in the company, in part because they’re introduced into networks of pre-existing liking and trust•Potential dangers and"
    ],
    "type": "easy",
    "answer pages": [
      9,
      10,
      11
    ],
    "document": [
      "17 - Social Influence and HRM (examples).pdf"
    ]
  },
  {
    "question": "How did Intel support inclusion?",
    "answer": "Sharing representation data publicly.",
    "contexts": [
      "UNITY and HRM: examples•Onboarding as Identity-Building–an HR department designs onboarding not just to communicate policies, but to create in new hires a shared identity•New employees are told, “Welcome to the Company X family”; they hear stories of founding struggles, company legends, and shared values; they meet \"culture mentors\" who help socialize them into the company’s norms.•The goal is to transform the organization from a workplace into a source of identity, which strengthens affective",
      "a source of identity, which strengthens affective commitment•Cross-Functional Rituals and Symbols–Zappos is famous for using company-wide rituals (like “Zappos Culture Book,” peer-recognition systems, and costumed events) to reinforce a sense of fun, inclusive unity across departments•by creating shared symbols and language across different roles, Zappos minimizes siloed thinking and fosters a strong shared identity.•outcomes: higher collaboration and lower turnover due to emotional",
      "collaboration and lower turnover due to emotional attachment•Potential dangers and risks–beware of the potential contradiction with individual incentives–failing to recognize the relevance “subcultures” and “sub-identities”within organizations (based on local culture, profession, tasks and functions etc)–superficial / artificial unity-building initiatives"
    ],
    "type": "easy",
    "answer pages": [
      14,
      15,
      16
    ],
    "document": [
      "17 - Social Influence and HRM (examples).pdf"
    ]
  },
  {
    "question": "What is a risk of conformity messaging?",
    "answer": "Accidentally normalizing negative norms.",
    "contexts": [
      "RECIPROCITY and HRM: examples•Investing in Employee Development–employees in companies that offers generous training, certifications, development initiativesshow more loyalty(lower turnover) and more discretionary effort and performance•the benefit in performance is not just about better skills, but also more effort because of a sense of “reciprocity” activated by the investment in them made by the company•Salesforce and SAP invest heavily in reskilling and internal mobility programs, which are",
      "and internal mobility programs, which are linked to strong internal talent retention•Flexibility and Work-Life Balance–when leaders allows remote work for caregiving or family reasons, a number of positive behavioral consequences can be observed:•Employees voluntarily adjust schedules, work extra during critical times, or remain more loyal.•Studies on Perceived Organizational Support (POS) show strong links between feeling supported and organizational citizenship behavior (OCB)•Potential",
      "citizenship behavior (OCB)•Potential dangers and risks–Reciprocity must be ... reciprocal! if the organization fails to reciprocateand employee’s efforts, disengagement follows–Perceived coercion: if reciprocity feels obligatory, not voluntary, it may generate cynicism of compliance without engagement•e.g. Employees are pressured to donate to a company-sponsored cause, participate in wellness programs, or mentor without recognition or compensation"
    ],
    "type": "easy",
    "answer pages": [
      18,
      19,
      20
    ],
    "document": [
      "17 - Social Influence and HRM (examples).pdf"
    ]
  },
  {
    "question": "Why do scarce awards motivate?",
    "answer": "Perceived prestige increases value.",
    "contexts": [
      "to be able to understand the difference between NORMATIVEand INFORMATIONALconformity3.the idea that RECIPROCITYis a crucial social norm: it’s the foundation of COLLABORATION, which is essential for any effective organization4.the idea that we are very sensitive to AUTHORITY, which is at the same time essential for coordination but it also has several potential dangers5.the idea that there are several general principles that, in some situations, can help us significantly in building better",
      "can help us significantly in building better relationships (unity, consistency, liking: all these are to some extent related to IDENTITY)6.the idea that EFFECTIVE LEADERSHIPis mostly about managing relationships, esepcially in small groups and in complex tasks, as we will see in the final part of our course",
      "10"
    ],
    "type": "easy",
    "answer pages": [
      23,
      24,
      25
    ],
    "document": [
      "17 - Social Influence and HRM (examples).pdf"
    ]
  },
  {
    "question": "What is an informational cascade?",
    "answer": "Imitating early choices while ignoring private info.",
    "contexts": [
      "Conformity behaviors of group members may cumulate andreinforce each other over time, and create a «snowball»(cascade) effect, which may generate undesired or suboptimaloutcomes. Key elements:- what happens at thebeginningof a process has an excessiveinfluence on the final outcome- the final outcome may becomeunpredictableand / orweaklycorrelatedwith the factual elements of the problem- behaviors and choice that areindividually rationalmaygenerate collective outcomes that areirrational, given",
      "collective outcomes that areirrational, given theavailable information-CASCADES = CONFORMITY + TIME + VISIBILITY +CRITICAL MASS",
      "AN EXPERIMENT ON INFORMATIONAL CASCADES (1)\n12\nEven rational choices (at the individual level) may lead to an irrational choice (at the group level) because of the cascade effect2/3 prob BLUE, 1/3 prob REDBLUE URN\n1/3 prob BLUE, 2/3 prob REDRED URN"
    ],
    "type": "easy",
    "answer pages": [
      20,
      21,
      22
    ],
    "document": [
      "18 - Group Pathologies.pdf"
    ]
  },
  {
    "question": "What is group polarization?",
    "answer": "Group discussion pushes toward extremes.",
    "contexts": [
      "1. Internal Competition and Sabotage• Employees had incentives toundermine peersto avoid being in the bottom tier.• Collaboration, knowledge sharing, and team cohesion were weakened: “I had tomake my colleagues look bad so I wouldn’t be ranked last.” (anonymous Microsoftengineer)2. Demoralization and Stress• Even average or good performers fearedarbitrary low ratingsdue to the fixed quotas• Chronic job insecurity, especially in high-performing teams where someonehadtobe in the bottom 10%3. Loss",
      "where someonehadtobe in the bottom 10%3. Loss of Talent• Highturnover of skilled individualswho rejected toxic competition.• Microsoft’s adopted stack ranking widely, but by the late 2000s it was linked todeclining innovation and employee disengagement.• Internal memos and leaked reports described it as the “most destructive process atMicrosoft.”• Microsoft eventually abolished stack ranking in 2013, replacing it with a morecollaborative performance review system.",
      "Forced ranking example: common consequences\n18"
    ],
    "type": "easy",
    "answer pages": [
      40,
      41,
      42
    ],
    "document": [
      "18 - Group Pathologies.pdf"
    ]
  },
  {
    "question": "Define groupthink.",
    "answer": "Decision failure due to unanimity pressure.",
    "contexts": [
      "MUCHNIK’S EXPERIMENT\n25\nThis is not just true for topics where judgment is less «objective» or more easy to influence.Notice: the BUSINESS category is the most influenced one!\nSALGANICK’S EXPERIMENTS: informational + availability\n26",
      "26\nOver 14000 people participating to an artificial «cultural market» (songs)«INDEPENDENT» GROUP (control group)•hidden downloads•no social influence«SOCIAL» GROUPS•8 different «social» groups, completely isolated from each other•public downloads•Experiment A: no ranking (random order)•Experiment B: with ranking, updated in real time•",
      "SALGANICK’S EXPERIMENTS: informational + availability\n27\nRESULTS:- Social worlds generate much more «inequality», in terms of individual success- Much more difference between big sellers and small sellers- Social worlds generate less predictabile results and less correlated with the intrinsic qualityof individuals-Especially when individuals are ranked\n\nSALGANICK’S EXPERIMENTS: informational + availability\n28\n\nPOLARIZATION"
    ],
    "type": "easy",
    "answer pages": [
      61,
      62,
      63
    ],
    "document": [
      "18 - Group Pathologies.pdf"
    ]
  },
  {
    "question": "Name a groupthink risk factor.",
    "answer": "High cohesion under strong leadership.",
    "contexts": [
      "•LIKING (and SIMILARITY)• we prefer to interact with people we like (Cialdini’s liking principle)• similarity leads to unbalanced initial positions >> polarization• online echo-chambers, social media etc•GROUP ISOLATION / LOW DISSENT TOLERANCE• When groups are insulated from external views or actively discouragedissent, polarization thrives.• Organizational echo chambers or “yes-man” cultures are especially proneto this•STRONG GROUP IDENTITY / HIGH IDENTIFICATION• High group identification",
      "/ HIGH IDENTIFICATION• High group identification increases motivation to maintain group cohesion,often by aligning with dominant opinions•NORMATIVE CULTURE EMPHASIZING PURITY OR IDEOLOGICALCONSISTENCY• Environments that reward moral clarity, uncompromising stances, orideological purity foster polarization",
      "What factors increase the probability of polarization? (2)\n37"
    ],
    "type": "easy",
    "answer pages": [
      81,
      82,
      83
    ],
    "document": [
      "18 - Group Pathologies.pdf"
    ]
  },
  {
    "question": "Why are these pathologies dangerous?",
    "answer": "They disconnect choices from facts.",
    "contexts": [
      "Definition of GroupThink•(Janis, 1972) “a mode of thinking that people engage in when they are deeply involved in a cohesive group, when the members’ strivings for unanimity over-ride their motivation to realistically appraise alternative courses of action”•In other words, Groupthink occurs within a cohesive decision-making group when the desire for harmony, consensus, or conformity becomes so dominant that it overrides the realistic appraisal of alternatives. Members suppress dissenting",
      "of alternatives. Members suppress dissenting viewpoints, fail to critically evaluate alternatives, and ignore potential risks, leading to poor or irrational decisions.45",
      "46\nJanis’ classic framework (part1)\n47\nJanis’ classic framework (part2)"
    ],
    "type": "easy",
    "answer pages": [
      101,
      102,
      103
    ],
    "document": [
      "18 - Group Pathologies.pdf"
    ]
  },
  {
    "question": "What is wisdom of crowds?",
    "answer": "When independent, diverse groups outperform individuals.",
    "contexts": [
      "16",
      "The story of Innocentive (2)•By 2003, the idea was so succesful that Innocentive became a spin-off from Eli Lilly•Now it features technical and scientific challgenges from hundreds of corporations of all industries, in all scientific fields•200.000 «solvers» registered today; about 40% of challenges are solved within 6 months. Sometime within a few days. How is this possible? –the power of numbers–the power of diversity: most solutions come from people that are NOT expert in the specific field",
      "people that are NOT expert in the specific field that originates the problem, but from people from different, adjacents fields.•A company was trying to invent a polymer with a very unique and perplexing set of chemical properties. “Nobody was optimistic that InnoCentive could help the client,” However, after a few months, solvers on the website came up with 5 different solutions to the problem. “The company paid for all the solutions. They paid awards to a person who studies carbohydrates in"
    ],
    "type": "easy",
    "answer pages": [
      20,
      21,
      22
    ],
    "document": [
      "19 - Techniques for Group Effectiveness.pdf"
    ]
  },
  {
    "question": "What is Condorcet’s Jury Theorem?",
    "answer": "Majority accuracy rises with group size if members are >50% accurate.",
    "contexts": [
      "•Solving complex problems often requires group efforts•A good group effort requires that we are able to separate«conflict between ideas»from «conflict between people»(«dare to disagree»is the title of Heffernan’s speech)•«CONFLICT BETWEEN IDEAS»: it supposed to be a healthy, useful, fact-based, competence-based conversation that tries to leverage all the information and intelligence at the group’s disposal•This is not easy, because we tend to confuse the two. For example, we tend to attach our",
      "the two. For example, we tend to attach our personal identity and dignity to our ideas•Diversity helps(a lot): that is what nurtures the possibility of comparing different ideas•However, diversity needs to be:•GENERATED, because it is not always easily available•MANAGED, becase it may lead to conflict between people•PROPERLY UTILIZED, because diversity alone may not generate good ideas•There are tools and techniques that help us to do all that",
      "Some general «conditions» for group effectiveness\n26"
    ],
    "type": "easy",
    "answer pages": [
      41,
      42,
      43
    ],
    "document": [
      "19 - Techniques for Group Effectiveness.pdf"
    ]
  },
  {
    "question": "Why does diversity help?",
    "answer": "Errors can cancel around the truth.",
    "contexts": [
      "•Define the Problem Clearly(Blue Hat)•The facilitator introduces the issue and sets the goals•Explore the Facts(White Hat)•Participants list known facts, data, and information gaps•Share Reactions/Intuition(Red Hat)•Each person states their emotional response (no justification needed)•Identify Risks and Pitfalls(Black Hat)•Participants explore flaws, risks, potential failures, worst case scenarios•Explore Positive Possibilities(Yellow Hat)•Focus on strengths, advantages, benefits, best-case",
      "on strengths, advantages, benefits, best-case scenarios•Generate New Ideas(Green Hat)•Think divergently, propose alternatives or lateral ideas•Reflect and Decide(Blue Hat again)•Summarize, reflect on outcomes, and plan next steps",
      "ROLE PLAYING: different implementation methods (2)\n35"
    ],
    "type": "easy",
    "answer pages": [
      62,
      63,
      64
    ],
    "document": [
      "19 - Techniques for Group Effectiveness.pdf"
    ]
  },
  {
    "question": "How to prevent groupthink?",
    "answer": "Ensure independence and invite dissent.",
    "contexts": [
      "from «divergence» to «convergence»: the DELPHI method•TheDELPHImethod is an example of a «CONVERGENCE» mechanism for groupdecision making•the goal is tohelp the group to reach a consensus(to converge) in an effective,un-biased way•torefine, select, filter, compare, evaluateexistingideas•typically used inlater stagesof a decision making process•it is usuallytime-consuming(so, it’s not great when speed is crucial)•it requires that involved individuals already possess agood degree of",
      "individuals already possess agood degree of expertise•often used for forecasting and planning (but not only)•as opposed to «DIVERGENCE» techniques (such as brainstorming») which are designedto help the group to generate many, different ideas, solutions, etc•typically used inearlierstages of a decision making process",
      "44"
    ],
    "type": "easy",
    "answer pages": [
      82,
      83,
      84
    ],
    "document": [
      "19 - Techniques for Group Effectiveness.pdf"
    ]
  },
  {
    "question": "What is an innovation tournament?",
    "answer": "A contest to surface diverse solutions.",
    "contexts": [
      "the «PRE-MORTEM» examples: Nasa\n50",
      "•Aviation and space organizations like NASAand Boeinghave long used pre-mortem-style planning to prevent catastrophic failure•a similar approach is used for pilots training, through simulators•NASA’s example: before every major mission, NASA teams conduct what is essentially a formalized pre-mortem:•“Let’s assume the mission ends in failure. What are the possible causes?”•Teams brainstorm failure scenarios from engineering (fuel leaks, telemetry failure) to organizational (miscommunication,",
      "failure) to organizational (miscommunication, rushed timelines)•They document and simulate failuresin mission control rehearsals, exposing psychological blind spots in advance•NASA also uses “Black Team” simulations, where a subgroup plays the role of saboteurs or unforeseen systemic risk"
    ],
    "type": "easy",
    "answer pages": [
      103,
      104,
      105
    ],
    "document": [
      "19 - Techniques for Group Effectiveness.pdf"
    ]
  },
  {
    "question": "Why is leadership important?",
    "answer": "Leaders shape decisions, culture, and performance.",
    "contexts": [
      "too indulgent leaders)•Values- and ethics-based definitions–Effectiveness = leader advances shared values and contributes to the common good–Problem: values are often subjective, culturally variable, or difficult to quantify•Multidimensional approaches–all the mentioned above factors should be considered at the same time•adaptabilityis also relevant–Consider that leadership effectiveness means different things in different sectors–but across domains, it consistently involves the ability to",
      "domains, it consistently involves the ability to align people and systems toward meaningful goals, sustain trust and commitment, and adapt to context.",
      "12\nSOME VERY WELL KNOWN LEADERSHIP STORIES\nSatya Nadella, Microsoft\nSteve Jobs, Apple\nNelson Mandela\nVineet Nayar, HCL\nIndra Nooyi, Pepsi\nEllen Johnson Sirleaf\nMalala Yousafzaiwhat do they have in common?I invite you to learn about their stories (and many others)Every story is unique, but there’s always a common element of personal growth, change, evolution, overcoming\nSheryl Sandberg,Meta\n13"
    ],
    "type": "easy",
    "answer pages": [
      15,
      16,
      17
    ],
    "document": [
      "20 - Leadership.pdf"
    ]
  },
  {
    "question": "Emergence vs effectiveness — difference?",
    "answer": "Becoming noticed as leader vs delivering good leadership.",
    "contexts": [
      "19",
      "A DIFFERENT PERSPECTIVE: METHODOLOGICAL LEADERSHIPa general definition:METHODOLOGICAL LEADERSHIP is a form of leadership grounded in the competenceto design, implement, and sustain the social, psychological, and procedural conditionsthat enable a group to collaborate effectively, learn continuously, and achieve complex goals. Rather than focusing on the content of decisions or personal charisma, the methodological leader exercises authority primarily in shaping how the group works—through",
      "primarily in shaping how the group works—through methods, norms, decision protocols, communication structures, and shared practices. This type of leadership draws from disciplines such as group dynamics, organizational behavior, cognitive and social psychology, and is oriented toward creating collective intelligence and well-being."
    ],
    "type": "easy",
    "answer pages": [
      31,
      32,
      33
    ],
    "document": [
      "20 - Leadership.pdf"
    ]
  },
  {
    "question": "Name three classic styles.",
    "answer": "Autocratic, Democratic, Laissez-faire.",
    "contexts": [
      "compete with giants such as IBM and Accenture•He set a very challenging goal. DSGi, a very large electronic retail company, was lookingfor offers for its ICT infrastructure. It was potentially a huge business deal for HCL. Itwould take months to put together a good offer. Nayar thought that this challenge would be needed to shake things up and mobilize people towards a new direction•He took some quick change initiatives (process reegineering, talent developmente tc)•These and other initiatives",
      "developmente tc)•These and other initiatives were useful, butinsufficient to create the kind of organization and culture that Nayar wanted. Something different was needed.•Nayar asked: “What if we turned everything upside down? What if management were accountable tothe value zone and the people in it? What if we could put employees first?”",
      "EMPLOYEES FIRST•Nayar created a team to think creatively about how to launch an internalcommunication and engagement campaign, to change people’s thinking and attitude•The new motto was “Employees First, Customer Second”. A radically new vision.•They also utilize a symbology that evoked the relevance of the individual and the strength of the collective. They chose «THAMBI», in Tamil language means «brother». Thambi was the symbol of an extraordinary individual, with pride, passion and focus on"
    ],
    "type": "easy",
    "answer pages": [
      46,
      47,
      48
    ],
    "document": [
      "20 - Leadership.pdf"
    ]
  },
  {
    "question": "What does Fiedler propose?",
    "answer": "Effectiveness depends on style–situation match.",
    "contexts": [
      "that the CEO had all the answers. He created a section called «MY PROBLEMS», in which Nayar himself posted his own problems and asked employees, anyemplyees, suggestions about how to solve them. He received a very large number of excellent ideas and advices. Most of all, he wanted that the sense of «ownership» and «responibility» spread around to everybody, instead of being concentrated on very fewpeople.•In 2006, the 360° review system was extended to everybody in the company. 1500 managers",
      "to everybody in the company. 1500 managers complied. At some point, Nayar imposed all managers to adhere.",
      "CREATING A COMMUNITY OF COMMUNITIES•The Employee First Councilswere created: spontaneous online communities in which anyemployee could discuss any topic, not just strictly related to work. The success wasenormous. There were 2500 Council Leaders around the world. •At that point, HCL created some Councils focused on relevant technological problems for the company. The success was such that many new ideas born in the Councils truned intonew products, services and technologies. •Unstructured"
    ],
    "type": "easy",
    "answer pages": [
      62,
      63,
      64
    ],
    "document": [
      "20 - Leadership.pdf"
    ]
  },
  {
    "question": "Why is effectiveness hard to define?",
    "answer": "It depends on outcomes, ethics, and context.",
    "contexts": [
      "WHAT DO WE LEARN FROM NAYAR’S STORY? (3)3. General conditions that are very important in most, if not all, organizations, that leaders have the responsibility to create and encourage:•MUTUAL TRUST between management and operatives•Management trusts the ability and competence of operatives•Operatives trusts the strategic, methodological and cultural «vision» of the management•Trust must be reciprocal, it must go in both directions: One cannot hope of operatives trusting management ifmanagement",
      "of operatives trusting management ifmanagement does not trust the operatives•TRANSPARENCYabout ... everything•How can you develop trust without transparency? How can you have transparency without trust? Thesetwo things are the same. They are two side of the same coin. They imply each other . •PRIMACY of COMPETENCE, not of HIERARCHY•Hierarchy and authority are important tools (for coordination, for methodological implementation, for strategic decisions) but they cannot replace competence•Good",
      "but they cannot replace competence•Good ideas and effective solutions can come from ... anywhere. The fact that a certain idea is good doesNOT depend on its source, but only on its MERIT•Focus on personnelGROWTH, not just PERFORMANCE: growth leads to sustainable performance•THE RELEVANCE OF COLLABORATION and RECIPROCITY•The most impactful ideas and contributions often come from groups, collaborative efforts, cross-fertilization between different expertise areas•Examples: the «Employees"
    ],
    "type": "easy",
    "answer pages": [
      77,
      78,
      79
    ],
    "document": [
      "20 - Leadership.pdf"
    ]
  },
  {
    "question": "What is expected utility?",
    "answer": "Probability-weighted utility used for rational choice.",
    "contexts": [
      "9",
      "From «abstract» rationality to «human» rationality•If we want to understand HUMAN decision making, we need to consider:•we have limited time, energy, resources–both individually and collectively•we often have conflicting, unclear goals•we often have incomplete, inaccurate information•we often use intuitive, implicit processes within our decision making process•we need to balance effectiveness and efficiency•we make decisions within a context, and the influence of context is extremely",
      "and the influence of context is extremely significant"
    ],
    "type": "easy",
    "answer pages": [
      8,
      9,
      10
    ],
    "document": [
      "01 - Introduction to Decision Making.pdf"
    ]
  },
  {
    "question": "What is bounded rationality?",
    "answer": "We satisfice due to limits in time and cognition.",
    "contexts": [
      "13\nA crucial trap to avoid: the «OUTCOME BIAS»OUTCOMEPOSITIVENEGATIVEQUALITY of the DECISION PROCESSGOODBADdeserved successbad luckgood luck deserved failure\nIN REALITY\n14\nA crucial trap to avoid: the «OUTCOME BIAS»OUTCOMEPOSITIVENEGATIVEQUALITY of the DECISION PROCESSGOODBADdeserved successdeserved failure (or, sometimes, bad luck)deserved successdeserved failure (or sometimes, bad luck)\nWHAT WE THINK\n15",
      "WHAT WE THINK\n15\nMistakes to avoid and approach to embraceOUTCOMEPOSITIVENEGATIVEQUALITY of the DECISION PROCESSGOODBAD",
      "ERROR: I used a good process, so no need to examine or change itERROR: I used a bad process,so I need to change itERROR: I used a good process, so no need to examine or change itERROR: I was unlucky, so no need to examine and change my processCORRECT APPROACH: Even thougheverything went well, I can still learn about how to improve my processCORRECT APPROACH: I need to understand that the bad outcome was due to bad luck and how an even better process can decrease the influence of luckCORRECT"
    ],
    "type": "easy",
    "answer pages": [
      17,
      18,
      19
    ],
    "document": [
      "01 - Introduction to Decision Making.pdf"
    ]
  },
  {
    "question": "What is outcome bias?",
    "answer": "Judging decisions by results rather than process.",
    "contexts": [
      "19\n\n20\nA USEFUL ANALOGY (from Thaler and Sunstein)•Carol is the manager of an elementary school in a big city•She realized that the way foods are laid out on the buffet greatly influences children’s choices",
      "21\nA USEFUL ANALOGY (from Thaler and Sunstein)•Carol’s options (among many others)–1. TO MAXIMISE CHILDREN’S WELL BEING–2. TO MAXIMISE CHILDREN’S HAPPINESS–3. TO MAXIMISE THE FINANCIAL RESULTS FOR THE SCHOOL–…. (many others)But, she doesn’t really want to influence the children’s food choices. After all, this is not her job. She doesn’t want such responsibility. What could she do? Is she really able to make sure that the children’schoice are not influenced by the food layout? \n22",
      "A USEFUL ANALOGY (from Thaler and Sunstein)•ANY order in the buffet will influence the childrens’ choices•The difference is that: –in some cases, she can use her knowledge about the childrens’ behavior to achieve some goals (maximise their health, the financialresults etc)•please notice: what goals are worth pursuing is a completely differentmatter, outside of our perimeter of interest in this course–in other cases (e.g., random order) she does not pursue any goalWHO IS CAROL?WHO ARE THE"
    ],
    "type": "easy",
    "answer pages": [
      25,
      26,
      27
    ],
    "document": [
      "01 - Introduction to Decision Making.pdf"
    ]
  },
  {
    "question": "Why does context matter?",
    "answer": "It strongly shapes goals, info, and choices.",
    "contexts": [
      "WHAT KIND OF «DECISION CONTEXT» ARE WE TALKING ABOUT?•Information we have / receive / search•the way information is collected, communicated•the way the problem is presented, described•social interactions•the relationship with colleagues, collaborators, leaders, customers etc•culture and norms (at the organizational and social level)•rules, procedures, incentives, symbols, traditions etc.•including rules and procedure for making decisions that are acceptedand utilized in the organization•the",
      "are acceptedand utilized in the organization•the physical layout / environment of work•spaces, buildings, lights, colors etc",
      "26"
    ],
    "type": "easy",
    "answer pages": [
      34,
      35,
      36
    ],
    "document": [
      "01 - Introduction to Decision Making.pdf"
    ]
  },
  {
    "question": "What is a choice architect?",
    "answer": "Anyone designing the context where others decide.",
    "contexts": [
      "make better conscious decisions, through»better / simplified information»better / simplified decision mechanisms»warnings, reminders, feedbacks etc»This is obviously a better approach in «philosophical» terms (decreasing the directinfluence on the outcomes of people’s decisions and behaviors and preserving a deeper sense of choice «freedom»)»However, system 2 approaches are usually not as effective and / or as easy to implement as the more «implicit nudges»",
      "31",
      "What alternatives do we have?•Knowledge about people’s behavior and how they make choices isjust a «tool», just an «instrument»–Like any instrument, it can be used for good or bad purposes–There is nothing intrinsically positive or negative in such knowledge. it is just a matter of how it is used•And ...  what is the alternative? Could we design contexts that haveNO INFLUENCE whatsoever on people’s behavior?–it is very difficult, very often it is quite impossible(Carol has to put the foods"
    ],
    "type": "easy",
    "answer pages": [
      42,
      43,
      44
    ],
    "document": [
      "01 - Introduction to Decision Making.pdf"
    ]
  },
  {
    "question": "What is loss aversion?",
    "answer": "Losses loom larger than equal gains.",
    "contexts": [
      "10\nHERE’S HOW MEDICAL DOCTORS RESPONDCHOOSE SURGERY50%84%EXPERT PEOPLE CHOOSE DIFFERENTLYWHEN ASKED THE SAME IMPORTANT QUESTION, WITH THE SAME DATA !!!CHOOSE SURGERY\nCASE ACASE BProf. Giovanni MasinoUniversity of Ferrara \n11",
      "FRAMING PROBLEMS–When we try to solve a problem or make a decision, we have to «frame» it somehow, whether we are aware of it or not ...•Carol has to put the food somewhere ...–We need to choose:-our goals-how we define or measure success / failure-the words we use-the measurement units-the metaphors-what is pertinent and what is not-etc.–So, we need to be well aware about the consequences (in terms of thinking and choosing) of the kind of frame we chooseProf. Giovanni MasinoUniversity of",
      "frame we chooseProf. Giovanni MasinoUniversity of Ferrara"
    ],
    "type": "easy",
    "answer pages": [
      10,
      11,
      12
    ],
    "document": [
      "02 - Prospect Theory and Framing Problems.pdf"
    ]
  },
  {
    "question": "When are people risk-seeking?",
    "answer": "In the loss domain (to avoid sure losses).",
    "contexts": [
      "riskier options (and viceversa)•Coughlan and Connolly (2001): satisfactionfor a certain work performance is influenced by the type of referencethat is has been used–the same DECREASE / INCREASE in performance is perceived (in terms of DISSATISFACTION / SATISFACTION) more or less strongly depending on the fact that the reference (expectation) suggests a negative (loss) or a positve (gain) frameProf. Giovanni MasinoUniversity of Ferrara",
      "16",
      "EXAMPLES of LOSS AVERSION and FRAMING in HR MANAGEMENT (1)•Scenario: HR may propose a new compensation system (e.g., shifting from fixed salary to performance-based bonuses). How would you design / frame this proposal to make it more acceptable, given what you just learned about loss aversion and framing?•Some employees may resist the change because they fear losing their guaranteed salary, even if the new structure could lead to higher overall pay if performance targets are met.•Loss Aversion:"
    ],
    "type": "easy",
    "answer pages": [
      21,
      22,
      23
    ],
    "document": [
      "02 - Prospect Theory and Framing Problems.pdf"
    ]
  },
  {
    "question": "What is a reference point?",
    "answer": "The baseline defining gains vs losses.",
    "contexts": [
      "19",
      "FRAMING AND BUSINESS STRATEGYJ. O’Toole research on General Motors’ frame in the 70s1. GM “is in the business of making money, not cars”2. Success do not come from tecnological leadership, but from quickly adopting innovations developed by others3. Cars are status symbols. Style is more important than quality. Users trade up well before quality becomes a problem4. US market is isolated. No foreign competitor will never be able to acquire more than 15% of the US market5. Energy will always be",
      "than 15% of the US market5. Energy will always be abundant and cheap6. Labor does not have a significant impact on production quality7. Social and environmental concerns are not relevant in the US market8. Central governement is an enemy9. Tight central control is the secret of good organization10. Managers should be trained internally"
    ],
    "type": "easy",
    "answer pages": [
      31,
      32,
      33
    ],
    "document": [
      "02 - Prospect Theory and Framing Problems.pdf"
    ]
  },
  {
    "question": "What is framing?",
    "answer": "Presentation that changes how options are perceived.",
    "contexts": [
      "Prof. Giovanni MasinoUniversity of Ferrara \n25",
      "THE INFLUENCE OF METAPHORS IN FRAMING•Crime is a {wild beast preying on / virus infecting} the city of Addison. The crime rate in the once peaceful city has steadily increased over the past three years. In fact, these days it seems that crime is {lurking in/ plaguing} every neighborhood. In 2004, 46,177 crimes were reported compared to more than 55,000 reported in 2007. The rise in violent crime is particularly alarming. In 2004, there were 330 murders in the city, in 2007, there were over 500.",
      "-ENFORCE: punish, sanction, policing, etc-REFORM: prevent, change society, improve economic conditions, education, etcProf. Giovanni MasinoUniversity of Ferrara \n26"
    ],
    "type": "easy",
    "answer pages": [
      42,
      43,
      44
    ],
    "document": [
      "02 - Prospect Theory and Framing Problems.pdf"
    ]
  },
  {
    "question": "What medical example shows framing effects?",
    "answer": "Surgery vs radiation survival/mortality wording.",
    "contexts": [
      "technologies. •If the public agency needed to go further, they could promise that some form of ‘tourist tax’ will be created and funnelled to a fund for this purpose.Prof. Giovanni MasinoUniversity of Ferrara",
      "29",
      "3. «FRAME ACCOMODATION»•This is where one side (or both) changes their framing to accommodate aspects of the opposing frame. •EXAMPLE•The charity succeeded in re-framing the idea of economic development to include wider concepts of value. For example, the charity could make the case that people would have better mental health and social capital if they had better access to the environment. They could point out that quality of life already forms part of the economic assessments in healthcare (as"
    ],
    "type": "easy",
    "answer pages": [
      52,
      53,
      54
    ],
    "document": [
      "02 - Prospect Theory and Framing Problems.pdf"
    ]
  },
  {
    "question": "What is confirmation bias?",
    "answer": "Seeking/valuing information that supports beliefs.",
    "contexts": [
      "THE KEY ISSUE: OVER-CONFIDENCE LEADS TO CONFIRMATION BIAS•A particularly important consequence of over-confidence is that ourinformation collecting and evaluation process becomes «biased»•Wesearch, consider and valuemostly (or only) information thatsupports (confirms) what we think we know alreadyThis is called CONFIRMATION BIAS–we dont look for information from sources that could disconfirm our ideas–when we encounter such information, we neglect them or rationalize them–we give too much",
      "neglect them or rationalize them–we give too much weight to information that confirm our ideas–we don’t give enough weight to information that disconfirm our ideas–we tend to associate with people that are similar to us in their ideas and judgment•The damage to our ability to make effective decisions is significant, because:•WE ARE DEPRIVED OF POTENTIALLY RELEVANT INFORMATION•OUR ABILITY TO THINK CRITICALLY IS SIGNIFICANTLY REDUCEDprof. Giovanni Masino – University of Ferrara",
      "12"
    ],
    "type": "easy",
    "answer pages": [
      13,
      14,
      15
    ],
    "document": [
      "03 - Confirmation Bias and Availability Bias.pdf"
    ]
  },
  {
    "question": "What is availability bias?",
    "answer": "Judging likelihood by ease of recall.",
    "contexts": [
      "ignoring potential customers who prefer simple, non-tech-based programs.•They ask leading questionsin focus groups, such as: “How would you use an AI-driven workout planner?” instead of asking “Would you prefer an AI-driven planner over a traditional one?”•They dismiss customer commentsthat suggest many people actually prefer human coaching over AI-generated plans.•Even though the team has no vested interest in a particular belief, they fail to look for disconfirmatory evidence, such as:–Market",
      "for disconfirmatory evidence, such as:–Market reports showing that many users still prefer human trainers.–Past failures of similar AI-driven fitness apps.–Customer segments (e.g., older adults or casual exercisers) who may find the technology intimidating.prof. Giovanni Masino – University of Ferrara",
      "16"
    ],
    "type": "easy",
    "answer pages": [
      26,
      27,
      28
    ],
    "document": [
      "03 - Confirmation Bias and Availability Bias.pdf"
    ]
  },
  {
    "question": "What is overconfidence?",
    "answer": "Overestimating knowledge or judgment accuracy.",
    "contexts": [
      "WITH OUR DESIRE TO FIND CAUSAL LINKS, OR PREDICTABILITY, OR TO FIND SENSE AND MEANING, EVEN WHEN SUCH PATTERNS ARE NOT REAL OR UNPROVENWHAT CAN WE DO ABOUT IT?prof. Giovanni Masino – University of Ferrara",
      "21\nPHILIP TETLOCK’S RESEARCHP . Tetlock, University of Pennsylvania",
      "•large scale project, 1984 - 2003, then another one in 2011•284 prominent experts in politics / economics (intellectuals, academics, opinion leaders, journalists, politicians, managers etc)•28.000 verifiable predictions•in depth-interviews•RESULTS:•very bad accuracy of predictions, often worse or very close to casual predictions•most famous experts were particularly ineffective•COMMON CHARACTERISTICS OF THE BEST ONES:•they collect information from a variety of sources, especiallythose that"
    ],
    "type": "easy",
    "answer pages": [
      39,
      40,
      41
    ],
    "document": [
      "03 - Confirmation Bias and Availability Bias.pdf"
    ]
  },
  {
    "question": "Name one mechanism of confirmation bias.",
    "answer": "Preferentially weighting supportive evidence.",
    "contexts": [
      "prof. Giovanni Masino – University of Ferrara\n27",
      "confirmation bias and competence•An experiment with 2878 of the World Bank and Uk Department for International Development employees•they were given objective data about the effectiveness of a dermatological cream (something far from their specific competences)–65% expressed evaluations consistent with the objective data•Then, they were given objective information about the effectiveness of minimum wage policies–just 45% expressed evaluations consistent with the objective data, because the",
      "consistent with the objective data, because the majority of them had a strong preference for redistributive policies, so they “rationalized” (motivated reasoning) the data so to reconcile their own judgement / preferences with the dataCompetence, expertise, even intelligence do not necessarily protect against confirmation bias–in fact, people with such qualities may find it easier to find clever ways to peform “motivated reasoning”prof. Giovanni Masino – University of Ferrara"
    ],
    "type": "easy",
    "answer pages": [
      52,
      53,
      54
    ],
    "document": [
      "03 - Confirmation Bias and Availability Bias.pdf"
    ]
  },
  {
    "question": "What is a consequence of confirmation bias?",
    "answer": "Reduced critical thinking and poor decisions.",
    "contexts": [
      "33",
      "OTHER EXAMPLES IN MANAGEMENT•IN PROJECT MANAGAMENT / PLANNING–overconfidence in the ability to achieve positive outcomes in relation to medium-long term projects may result in:•too many plans / projects proposed (or, too ambitious in relation to actual capabilities)•too many plans / projects thatdo not achieve the expected outcomes•LEADERSHIP IN TEAMS and GROUP DECISION MAKING–leaders that are too «optimistic» decrease significantly the quality of group decisions, especially when groups face",
      "of group decisions, especially when groups face challenging / creative problems–group leaders should work as «antidotes» to group overconfidence, promote critical thinking, exploring multiple alternatives and underestimated risks etcprof. Giovanni Masino – University of Ferrara"
    ],
    "type": "easy",
    "answer pages": [
      65,
      66,
      67
    ],
    "document": [
      "03 - Confirmation Bias and Availability Bias.pdf"
    ]
  },
  {
    "question": "What is anchoring?",
    "answer": "Relying heavily on initial numbers when estimating.",
    "contexts": [
      "each other)•anchoring can be the outcome of social learning, which has important positive effects, but may also lead to negative consequencesprof. Giovanni Masino – University of Ferrara",
      "9\nan experiment on 600 public employees (in ITALY)•You are a Public Relations Manager of a average-sized municipality. You have to establish the maximum number of days within which your collaborators must respond the the citizines’ requests via email. Please consider whether the maximum days should be higher or lower than 2 (anchor low) / 90 (anchor hi)What would be the appropriate maximum number of days, in your opinion?\nABOUT 60% MANAGERS\nprof. Giovanni Masino – University of Ferrara\n10",
      "ANCHORING and MANAGEMENT•When managers need to solve a problem, a very obvious way to find possible solutions is to look at how similar organizations(competitors, for example) have solved that problem, especiallyif they have been successful in doing so•Looking at what «similar others» do is a very powerful anchor–e.g. looking at «benchmarks» or «industry standards»–in HRM: benefits, salary, career opportunities etc•That «external» solution becomes a powerful anchor; the managers may then"
    ],
    "type": "easy",
    "answer pages": [
      8,
      9,
      10
    ],
    "document": [
      "04 - Anchoring and Sunk Cost Bias.pdf"
    ]
  },
  {
    "question": "What is adjustment?",
    "answer": "Shifting from the anchor but not enough.",
    "contexts": [
      "14",
      "DEFAULTS AS ANCHORS–Defaults are extremely powerful, widespread anchors–Also, we tend to underestimate their effectsEXAMPLE: 3 groups of parents were informed about the possibility to participate to a free support program about their children school experience and performance. In order to participate:1)text message in which it was explained that they could participate by signing up through a website2)text message in which it was explained that they could participate by responding «start» to the",
      "could participate by responding «start» to the same message3)text message in which it was explained that they could cancel participation by responding «stop» to the same message"
    ],
    "type": "easy",
    "answer pages": [
      16,
      17,
      18
    ],
    "document": [
      "04 - Anchoring and Sunk Cost Bias.pdf"
    ]
  },
  {
    "question": "What is the sunk cost fallacy?",
    "answer": "Escalating commitment due to past investments.",
    "contexts": [
      "go back down immediately (night descent is very dangerous)Last part is extremely difficult. It takes 30 minutes just for a few metersprof. Giovanni Masino – University of Ferrara",
      "18\n prof. Giovanni Masino – University of Ferrara\n19\n prof. Giovanni Masino – University of Ferrara\n20\nWHAT HAPPENEDTurn-Around Rule“at 1 pm, you have to back down, no matter where you are”the rule was violated: they arrived on top at 4pmCognitive biases that help explaining the tragedy:Over-Confidence BiasRecency EffectSunk-Cost Effectprof. Giovanni Masino – University of Ferrara\n21\nOVER-CONFIDENCE\nprof. Giovanni Masino – University of Ferrara\n22",
      "THE UNPLEASANT SHOW EXAMPLEImagine you go to a theater to see a show (it could be a play, a concert, or a movie, it doesn’t matter)You pay 5 euros for the ticketYou know that the show will last for 2 hoursThe show beginsAfter 10 minutes, you realize that you HATEthe show. It’s the type of show that you really, really don’t like. And you know that it’s going to be just like that for 2 hours.What do you do? You a) stay for 2 hours watching a really terrible, horrible, show, or b) you get up"
    ],
    "type": "easy",
    "answer pages": [
      24,
      25,
      26
    ],
    "document": [
      "04 - Anchoring and Sunk Cost Bias.pdf"
    ]
  },
  {
    "question": "What is a default effect?",
    "answer": "Pre-set options powerfully shape choices.",
    "contexts": [
      "24\nSUNK-COST EFFECT in the EVEREST case•The TURN-AROUND RULE was a smart way to avoid the sunk cost effect, but ….\nprof. Giovanni Masino – University of Ferrara\n25",
      "Origins of the SUNK-COST EFFECTWhy do you think we tend to be influenced by sunk costs?Can you imagine some evolutionary advantages that may help explain itsorigin?•Advantages in action(more resilience, effort, motivation, etc)•Disadvanteges in decidingaboutwhataction to pursue (e.g. continuingon a course of action vs changing the course of action)•please notice the overlapping with the overconfidence bias (but there are also clear differences)–Difference: over-confidence is mostly about",
      "over-confidence is mostly about miscalibration of judgment, while the sunk cost effect is about loss-aversion (especially loss of self-esteem and reputation)prof. Giovanni Masino – University of Ferrara"
    ],
    "type": "easy",
    "answer pages": [
      32,
      33,
      34
    ],
    "document": [
      "04 - Anchoring and Sunk Cost Bias.pdf"
    ]
  },
  {
    "question": "Why can anchors hinder innovation?",
    "answer": "They bias solutions toward benchmarks.",
    "contexts": [
      "HOW TO DEAL WITH THE DANGER OF THE SUNK COST EFFECT4. Seek an Outside PerspectiveAsk someone who is not emotionally invested to evaluate the situation objectively5. Separate Ego from the DecisionRecognize that admitting a mistake is not failure, it’s smart decision-makingMany people persist because they don’t want to feel like they “wasted” resources, but wasting even more is worse.6. Use Probabilities and Expected Value- Instead of focusing on past investments, ask:  “What are the odds that",
      "past investments, ask:  “What are the odds that continuing will lead to success?”“Does the expected return justify further investment?”7. Learn from Past Mistakes Without Guilt- Instead of feeling bad about past failed investments, treat them as learning experiencesprof. Giovanni Masino – University of Ferrara",
      "28"
    ],
    "type": "easy",
    "answer pages": [
      40,
      41,
      42
    ],
    "document": [
      "04 - Anchoring and Sunk Cost Bias.pdf"
    ]
  },
  {
    "question": "What is choice overload?",
    "answer": "Too many options make choosing harder and less satisfying.",
    "contexts": [
      "10",
      "EXAMPLES IN HRM•Job Seekers & Recruitment Processes–too many job openings: When candidates face an overwhelming number of job opportunities (especially in online job markets), they may experience decision paralysis or post-decision regret after accepting an offer.–Too many applicants for a company: HR managers, when flooded with hundreds of resumes, might struggle to make a decision, leading to delays or poor hiring choices•Employee Benefits & Well-Being–Many companies offer extensive benefits",
      "companies offer extensive benefits packages (e.g., health plans, retirement options, perks). However, too many choices can lead to employee dissatisfaction and regret because they feel they might have chosen sub-optimally. –Simplifying choices or offering curated recommendations can improve decision satisfaction•Performance Reviews & Career Development–Employees who are given too many career advancement options (e.g., multiple training programs, leadership tracks) may struggle to choose the"
    ],
    "type": "easy",
    "answer pages": [
      7,
      8,
      9
    ],
    "document": [
      "05 - Choice Overload and Salience.pdf"
    ]
  },
  {
    "question": "Which jam study result is famous?",
    "answer": "24 jams attracted more attention, 6 jams sold more.",
    "contexts": [
      "12\nTHE RELEVANCE OF IRRELEVANT OPTIONS\n16 % people0 % people84 % peopleprof. Giovanni Masino – University of Ferrara\n13 68% (from 16%)32% (from 84%)\nTHE RELEVANCE OF IRRELEVANT OPTIONS\nprof. Giovanni Masino – University of Ferrara\n14",
      "ABSOLUTE VALUATION vs COMPARATIVE VALUATIONS•When analogies and comparisons are available, or easy to make, we tendto use them (to think «comparatively») in order to choose (instead of choosing through an assessment of the «absolute» value of each option)–this is not irrational (indeed, it has advantages from a «computational» point of view), but it may lead to mistakes–the same phenomenon has been obsereved in many animal species, even in neurologically very simple animals•The example of the",
      "very simple animals•The example of the Williams-Sonoma bread machineprof. Giovanni Masino – University of Ferrara"
    ],
    "type": "easy",
    "answer pages": [
      14,
      15,
      16
    ],
    "document": [
      "05 - Choice Overload and Salience.pdf"
    ]
  },
  {
    "question": "Name one remedy for overload.",
    "answer": "Reduce or categorize options.",
    "contexts": [
      "A social experiment in Switzerland•The average consumption of a 5 minutes warm shower is:–45 liters of water–2.6 Kwh of energy to make the water warm•about 2.5 times the average DAILY consumption in Switzerland to illuminate a house•about 4 times the energy consumption of modern refrigerator•Several experiments show a moderate savings in consumption if families are give periodical information about how much they consume in relation to their socially proximate families (up to 2% on energy",
      "socially proximate families (up to 2% on energy consumption and 5% on water)•The problem is that the feedback happens AFTER the consumption behavior. It is not SALIENT enough.•How can we change the behavior to reduce the energy consumption?prof. Giovanni Masino – University of Ferrara",
      "17"
    ],
    "type": "easy",
    "answer pages": [
      21,
      22,
      23
    ],
    "document": [
      "05 - Choice Overload and Salience.pdf"
    ]
  },
  {
    "question": "Why do more options lower satisfaction?",
    "answer": "They raise expectations and regret.",
    "contexts": [
      "prof. Giovanni Masino – University of Ferrara\n20\nCONCLUSIONSon decision making\nProf. Giovanni MasinoUniversity of Ferrara \n21",
      "A SUMMARY OF SUGGESTIONS TO IMPROVE DECISION MAKING (1)•BE AWARE OF THE FRAMESTHAT YOU USE TO UNDERSTANDS PROBLEMS •EXPERIMENT WITH MORE / DIFFERENT FRAMES•UTILIZE A VARIETYOF INFORMATION SOURCES•BE VERY SELECTIVE ABOUT THE QUALITY AND RELIABILITYOF YOUR INFORMATION SOURCES•LOOK FOR DISCONFIRMATORY INFORMATION•BE OPEN, WILLING AND GLAD TO CHANGE YOUR MIND, WHEN YOU HAVE GOOD REASONS TO DO SO•PAY ATTENTION NOT JUST ABOUT WHAT YOUR OPTIONS ARE, BUT ALSO TO HOW THEY ARE PRESENTEDTO YOU•BEWARE THE",
      "ALSO TO HOW THEY ARE PRESENTEDTO YOU•BEWARE THE EASILY AVAILABLE SOLUTIONSAND TAKEN FOR GRANTED JUDGMENTS (ANCHORS)•BE AWARE OF THE DEFAULTSYOU USE, AND EVALUATE THEMIN RELATION TO YOUR PREFERENCES AND GOALS•DO NOT RUSH IMPORTANT, COMPLEX DECISIONSprof. G. Masino- Bologna Business School"
    ],
    "type": "easy",
    "answer pages": [
      28,
      29,
      30
    ],
    "document": [
      "05 - Choice Overload and Salience.pdf"
    ]
  },
  {
    "question": "What is salience?",
    "answer": "Attention-grabbing features that guide choices.",
    "contexts": [
      "GENERAL CONCLUSIONS•WE MOSTLY FOCUSED ON SYSTEM 1 PROCESSES AND ON THE “BIASES” THAT CAN THEY GENERATE•FOCUSING ON BIASES DOES NOT MEAN THAT WE SHOULD NOT USE INTUITIVE THINKING•ON THE CONTRARY, SYSTEM 1 PROCESSES ARE ESSENTIAL AND VERY USEFUL, IF WE KNOW WHAT THEY ARE, HOW TO AVOID THOSE BIASES AND HOW TO USE INTUITIVE THINKING TO OUR ADVANTAGE•SELF-AWARENESS AND KNOWLEDGE IS THE KEY•FROM A POLICY IMPLEMENTATION AND ORGANIZATIONAL POINT OF VIEW, THE NUDGING APPROACH IS AN EMPIRICAL WAY TO",
      "VIEW, THE NUDGING APPROACH IS AN EMPIRICAL WAY TO LEVERAGE THIS KNOWLEDGE IN ORDER TO MAKE POLICIES AND ORGANIZATIONS MORE EFFECTIVE AND/OR EFFICIENT•HUMAN RESOURCE MANAGEMENT IS ABOUT PEOPLE, MUCH MORE THAN ABOUT TECHNIQUES–AND SO IS MANAGEMENT IN GENERAL•SO, IT IS ESSENTIAL FOR ANY HRM TO KNOW HOW AND WHY PEOPLE MAKE DECISIONS AND BEHAVE–INCLUDING HIMSELF/HERSELF!!•DECISION MAKING IS INVOLVED IN ALL HRM PROCESSES–RECRUITMENT AND SELECTION–PERSONNEL DEVELOPMENT–CAREER",
      "AND SELECTION–PERSONNEL DEVELOPMENT–CAREER PLANNING–COMPENSATION–LEADERSHIP–ETC"
    ],
    "type": "easy",
    "answer pages": [
      35,
      36,
      37
    ],
    "document": [
      "05 - Choice Overload and Salience.pdf"
    ]
  }
]